source,author,title,description,publishedAT,content
yahoo entertainment,gurufocus research,unveiling the investment potential of globus medical inc (gmed): a comprehensive analysis of ,delving into the financial metrics and competitive strengths that position globus medical inc for market outperformance,2023-10-03T17:03:18Z,"globus medical inc (nyse:gmed) has recently been in the spotlight, drawing interest from investors and financial analysts due to its robust financial stance with shares currently priced at $5155, g… [+4888 chars]"
marketscreenercom,globenewswire,globus medical and nuvasive to sponsor and participate at eurospine 2023,"(marketscreenercom) audubon, pa, sept 27, 2023 -- globus medical, inc , a leading musculoskeletal solutions company, today announced it will continue its partnership with eurospine as a silver sponsor and will attend eurospine 2023 held october 4 to 6 in …",2023-09-27T11:01:02Z,"audubon, pa, sept 27, 2023 (globe newswire) -- globus medical, inc (nyse: gmed), a leading musculoskeletal solutions company, today announced it will continue its partnership with eurospine as a s… [+6293 chars]"
globenewswire,research nester,"interspinous spacers market revenue to surpass usd 138 million by 2033, says research nester","major interspinous spacer market players include spine wave, inc, boston scientific corporation, globus medical, inc, spinal simplicity, life spine, inc, nuvasive, inc, medtronic plc, zimmer biomet, alphatec holdings, inc, and paradigm spine llc, major i…",2023-09-25T09:00:00Z,"new york, sept 25, 2023 (globe newswire) -- the global interspinous spacers market size is projected to expand at ~6% cagr between 2023 and 2033 the market is expected to garner a revenue of usd 13… [+8336 chars]"
marketscreenercom,,twenty years of the nuvasive xlif procedure celebrated at the society for minimally invasive spine surgery 2023 annual forum,"(marketscreenercom) audubon, pa, oct 10, 2023 -- globus medical, inc , a leading musculoskeletal solutions company, celebrated twenty years of the nuvasive xlif procedure at the society for minimally invasive spine surgery 23 annual forum “very few medi…",2023-10-10T11:02:02Z,"audubon, pa, oct 10, 2023 (globe newswire) -- globus medical, inc (nyse: gmed), a leading musculoskeletal solutions company, celebrated twenty years of the nuvasive xlif procedure at the society f… [+7908 chars]"
prnewswire,,"spinal trauma devices market size to grow by usd 54072 million from 2022-2027| alphatec holdings inc, bbraun se, choicespine llc and more are among the key market players - technavio","new york, sept 28, 2023 /prnewswire/ -- the spinal trauma devices market size is projected to increase by usd 54072 million, accelerating at a cagr of 577% during the forecast period, according to technavio research the report analyzes the market's compet…",2023-09-28T21:35:00Z,"new york, sept 28, 2023 /prnewswire/ -- the spinal trauma devices market size is projected to increase by usd 54072 million, accelerating at a cagr of 577% during the forecast period, according to… [+5615 chars]"
24/7 wall st,lee jackson,"wednesdays top wall street analyst upgrades and downgrades: arm, carnival, cvs health, dell, royal caribbean, sofi, southwest airlines, starbucks and more","wednesday's top analyst upgrades and downgrades included arm, carnival, cvs health, deere, dell technologies, intercontinental exchange, planet fitness, rackspace technology, royal caribbean cruises, sofi technologies, southwest airlines, starbucks and super …",2023-09-20T12:48:55Z,"the futures traded higher, after a risk-off tuesday in which all the major indexes closed lower once again, the song remains the same, as the impending announcement from the federal reserve is expec… [+4566 chars]"
marketscreenercom,business wire,livanova board appoints j christopher barry as new director,(marketscreenercom) long-time director andrea saia to retire from the board https://wwwmarketscreenercom/quote/stock/livanova-plc-24530529/news/livanova-board-appoints-j-christopher-barry-as-new-director-45001395/?utm_medium=rss&utm_content=20231006,2023-10-06T12:32:02Z,"livanova plc (nasdaq: livn), a market-leading medical technology company, announced its board of directors has appointed j christopher barry to the board, effective today barry will serve on the au… [+3219 chars]"
globenewswire,research and markets,key competitors in the soft tissue allografts market 2023 to 2030,"dublin, sept 25, 2023 (globe newswire) -- the ""soft tissue allografts: global strategic business report"" report has been added to researchandmarketscom's offeringglobal soft tissue allografts market to reach $71 billion by 2030the global market for soft t…",2023-09-25T12:33:00Z,"dublin, sept 25, 2023 (globe newswire) -- the ""soft tissue allografts: global strategic business report"" report has been added to researchandmarketscom's offering global soft tissue allografts ma… [+3304 chars]"
globenewswire,research and markets,global spine biologics market 2023-2030: rising demand for minimally invasive procedures: a key driver for the spine biologics market,"dublin, sept 22, 2023 (globe newswire) -- the ""global spine biologics market by product (bone graft substitutes, cell-base matrix, spinal allografts), application (non-fusion, spinal fusion), end-user - cumulative impact of covid-19, russia ukraine conflict,…",2023-09-22T10:33:00Z,"dublin, sept 22, 2023 (globe newswire) -- the ""global spine biologics market by product (bone graft substitutes, cell-base matrix, spinal allografts), application (non-fusion, spinal fusion), end-us… [+5640 chars]"
globenewswire,datahorizzon research,orthopedic implants market size to attain a usd 685 billion by 2032 | cagr of 70% | datahorizzon research,"fort collins, colorado, sept 20, 2023 (globe newswire) -- datahorizzon research published a report titled, ""orthopedic implants market size, growth, share, statistics report, by product (reconstructive joint replacements, spinal implants, dental implants, tr…",2023-09-21T00:30:00Z,"fort collins, colorado, sept 20, 2023 (globe newswire) -- datahorizzon research published a report titled, ""orthopedic implants market size, growth, share, statistics report, by product (reconstruct… [+8436 chars]"
globenewswire,prophecy market insights,spinal implant market is estimated to be us$ 199 billion by 2032; growing prevalence of spinal illnesses and emergence of new age spine implant to boost the market growth – by pmi,"prophecy market insights latest research report on the spinal implant market provides a comprehensive analysis of the current market scenario, growth opportunities, challenges, and emerging trends the report offers insights into the market's size and share, …",2023-09-28T14:30:00Z,"covina, sept 28, 2023 (globe newswire) -- introduction: spinal implants are instruments used during a spinal surgery to help support fusion, stabilization, and maintaining the strength in spine sp… [+5257 chars]"
globenewswire,vantage market research,artificial disc replacement market size & share to surpass $13 billion by 2030 | vantage market research,"washington, sept 25, 2023 (globe newswire) -- as per vantage market research, the global artificial disc replacement market has been steadily growing due to the increasing prevalence of degenerative disc diseases and the rising geriatric population",2023-09-25T12:10:00Z,"washington, sept 25, 2023 (globe newswire) -- as per vantage market research, the global artificial disc replacement market has been steadily growing due to the increasing prevalence of degenerative… [+15252 chars]"
globenewswire,prophecy market insights,[new launch] minimally invasive spine technologies market is estimated to be us$ 97 billion by 2032; growing geriatric population to fuel market growth – by pmi,"prophecy market insights latest research report on the minimally invasive spine technologies market provides a comprehensive analysis of the current market scenario, growth opportunities, challenges, and emerging trends the report offers insights into the ma…",2023-09-12T14:30:00Z,"covina , sept 12, 2023 (globe newswire) -- according to the latest research study, the demand of minimally invasive spine technologies market accounted for us$ 97 billion by 2032 and is estimated … [+6066 chars]"
globenewswire,the insight partners,"pedicle screw market revenue to cross $1billion, globally, by 2030 - exclusive report by the insight partners",global pedicle screw market is growing at a cagr of 63% during the 2022-2030 global pedicle screw market is growing at a cagr of 63% during the 2022-2030,2023-09-27T13:40:00Z,"pune, india, sept 27, 2023 (globe newswire) -- pedicle screws are used sometimes in a spinal fusion to add extra support and strength to the fusion while it heals pedicle screws are placed above an… [+8743 chars]"
globenewswire,tbrc business research pvt ltd,the orthopedic devices market is expected to grow at a cagr of 5% with rising geriatric population as per the business research company's orthopedic devices global market report 2023,the business research companys global market reports are now updated with the latest market sizing information for the year 2023 and forecasted to 2032 the business research companys global market reports are now updated with the latest market sizing inform…,2023-09-15T15:30:00Z,"london, sept 15, 2023 (globe newswire) -- the business research companys orthopedic devices global market report 2023, the global orthopedic devices market has demonstrated remarkable growth, increa… [+5495 chars]"
globenewswire,fortune business insights,"orthopedic devices market size to surpass usd 8028 billion by 2030, exhibiting a cagr of 45%","as per the report by fortune business insights, the global orthopedic devices market size is projected to reach usd 8028 billion in 2030, at a cagr of 45% during the forecast period, 2023-2030 as per the report by fortune business insights, the global ortho…",2023-09-27T12:53:00Z,"pune, india, sept 27, 2023 (globe newswire) -- global orthopedic devices market size was valued at usd 5684 billion in 2022 and is projected to grow usd 8028 billion by 2030, exhibiting a cagr o… [+5405 chars]"
globenewswire,the insight partners,"neurostimulation devices market 2023 report - reach $1182 billion, globally, by 2030 - comprehensive report by the insight partners",global neurostimulation devices market is growing at a cagr of 93% from 2022 to 2030 global neurostimulation devices market is growing at a cagr of 93% from 2022 to 2030,2023-10-04T14:32:00Z,"pune, india, oct 04, 2023 (globe newswire) -- neurostimulation devices attach electrodes to the brain, spinal cord, or peripheral nerves each device can collect and store data over time, and the na… [+9729 chars]"
globenewswire,emergen research,global orthopedic braces & supports market size to reach usd 701 billion in 2030 | emergen research,rising prevalence of musculoskeletal disorders is a major factor driving orthopedic braces & supports market revenue growth rising prevalence of musculoskeletal disorders is a major factor driving orthopedic braces & supports market revenue growth,2023-09-13T14:56:00Z,"vancouver, sept 13, 2023 (globe newswire) -- the global orthopedic braces &amp; supports market size was usd 402 billion in 2021 and is expected to register a revenue cagr of 64% during the foreca… [+13214 chars]"
globenewswire,consegic business intelligence private limited,"orthopedic devices market size to hit us$ 61,32144 million by 2031 | analysis report","consegic business intelligence analyzes that the orthopedic devices market is growing with a cagr of 42% during the forecast period (2023-2031), boosted by the growing number of patients with orthopedic disorders across the globe, and major comapanies includ…",2023-10-12T06:00:00Z,"new york, oct 12, 2023 (globe newswire) -- the global o rthopedic d evices m arket is expected to witness significant growth at a remarkable cagr of 42% during the forecast period of 2023-… [+13173 chars]"
prnewswire,,"medcura names barry, mcafee to leadership positions","dr john barry named group vice president of r&d and operations jp mcafee named vice president of legal affairs and compliance riverdale, md, sept 12, 2023 /prnewswire/ -- medtech leader medcura inc has added two new leadership team members with extensiv…",2023-09-12T14:03:00Z,"dr john barry named group vice president of r&amp;d and operationsjp mcafee named vice president of legal affairs and compliance riverdale, md, sept 12, 2023 /prnewswire/ -- medtech leader medc… [+3980 chars]"
prnewswire,,implantable medical devices market to grow by usd 511 billion from 2022-2027 | north america to account for 45% of market growth - technavio,"new york, sept 25, 2023 /prnewswire/ -- the implantable medical devices market size is expected to grow by usd 511 billion from 2022 to 2027 in addition, the momentum of the market will progress at a cagr of 825% during the forecast period, according to t…",2023-09-26T01:30:00Z,"new york, sept 25, 2023 /prnewswire/ -- the implantable medical devices market size is expected to grow by usd 511 billion from 2022 to 2027 in addition, the momentum of the market will progress a… [+6572 chars]"
prnewswire,,"cut resistant gloves market to grow by usd 94375 million from 2022 to 2027, the market is fragmented due to the presence of prominent companies like 3m co, ansell ltd and bob dale gloves and imports ltd, and many more - technavio","new york, sept 18, 2023 /prnewswire/ -- the cut resistant gloves market is estimated to grow by usd 94375 million from 2022 to 2027, growing at a cagr of 964% the cut-resistant gloves market is fragmented owing to the presence of many global and regional …",2023-09-19T01:15:00Z,"new york, sept 18, 2023 /prnewswire/ -- the cut resistant gloves market is estimated to grow by usd 94375 million from 2022 to 2027, growing at a cagr of 964% the cut-resistant gloves market is f… [+5571 chars]"
thefreedictionarycom,,the cerebral cortex,"the vertebrate brain's cerebrum is covered by an outer layer, or cortex, that is largely responsible for higher brain functions, including sensation, voluntary muscle movement, thought, reasoning, and memory it is composed of unmyelinated fibers that—in pres…",2023-09-27T04:21:22Z,"for the scientific journal, see cerebral cortex (journal) the cerebral cortex is the outer layer of neural tissue of the cerebrum of the brain, in humans and other mammals it is separated into two… [+40769 chars]"
