source,author,title,description,publishedAT,content
globenewswire,global market insights inc,"perfusion systems market to hit usd 2 billion by 2032, says global market insights inc",perfusion systems industry is projected to witness a cagr of 46% during the period 2023-2032 this growth can be attributed to the increasing prevalence of cardiovascular and respiratory diseases perfusion systems industry is projected to witness a cagr of …,2023-10-03T00:00:00Z,"selbyville, delaware, oct 02, 2023 (globe newswire) -- perfusion systems market size is expected to be worth usd 2 billion by 2032 the ongoing advancements in perfusion system technology, inclu… [+5944 chars]"
globenewswire,"jenavalve technology, inc",jenavalve appoints shlomi nachman to board of directors,"irvine, calif, sept 14, 2023 (globe newswire) -- jenavalve technology, inc, developer and manufacturer of differentiated transcatheter aortic valve replacement (tavr) systems, today announced that it has appointed shlomi nachman, experienced cardiovascular…",2023-09-14T13:00:00Z,"irvine, calif, sept 14, 2023 (globe newswire) -- jenavalve technology, inc, developer and manufacturer of differentiated transcatheter aortic valve replacement (tavr) systems, today announced that… [+3792 chars]"
globenewswire,research nester,"paracentesis drainage systems market revenue to hit usd 4 billion by 2035, says research nester","leading paracentesis drainage systems market players include merit medical systems, inc, cardinal health, inc, avanos medical, inc, teleflex incorporated, boston scientific corporation, gi supply, inc, cardiomed supplies inc, becton, dickinson and compan…",2023-09-12T13:02:00Z,"new york, sept 12, 2023 (globe newswire) -- the global paracentesis drainage systems market size is predicted to expand at ~ 7 % cagr between 2023 and 2035 the market is projected to garner a reven… [+11558 chars]"
psychology today,bradley thomas phd,white clinicians' guide to work more effectively with black patients,what's the point of providing culturally competent care if you can't identify your own implicit biases first?,2023-09-12T14:14:24Z,are you a white mental health provider seeking culture-centered care for black patients? asking yourself why you want to be in the practice of providing black patients with greater care is always a … [+12409 chars]
globenewswire,emergen research,global anastomosis devices market size to reach usd 585 billion in 2030 | emergen research,advancements in the number of cardiovascular surgical research activities is driving market revenue growth advancements in the number of cardiovascular surgical research activities is driving market revenue growth,2023-09-13T15:30:00Z,"vancouver, sept 13, 2023 (globe newswire) -- the global anastomosis devices market size reached usd 358 billion in 2021 and is expected to register a revenue cagr of 56% during the forecast peri… [+11252 chars]"
marketbeat,NA,2 beauty stocks beaten by the ugly stick but ready to rally,beauty stocks have not been pretty this year cosmetics retailer ulta beauty inc (nasdaq:ulta) and estee lauder co (nyse:el) shares are trading down 123% and 387%,2023-09-21T04:55:04Z,"key points <ul><li>hims &amp; hers provides a telehealth wellness and beauty platform offering medical consults, sexual health products, and over-the-counter and prescription medications convenientl… [+9208 chars]"
globenewswire,transparency market research,"global biosensors market to reach us$ 4849 billion by 2031, expanding at a cagr of 72%: tmr report","increasing government investments in healthcare and pharmaceutical industries, rising prevalence of cardiovascular diseases, diabetes, etc, and growing trend of self-monitoring are key factors driving the global biosensors market during the forecast period i…",2023-09-15T11:09:00Z,"wilmington, delaware, united states, sept 15, 2023 (globe newswire) -- the global biosensors market is projected to flourish at a cagr of 72% from 2021 to 2031 as per the report published by tmr, … [+8675 chars]"
globenewswire,transparency market research,"pet-ct scanner devices market to exceed usd 3104 million by 2031, expanding at a cagr of 31% says, transparency market research","increasing prevalence of conditions such as cancer, alzheimers, and cardiovascular diseases, which is creating the demand for medical devices such as pet-ct scanner devices increasing prevalence of conditions such as cancer, alzheimers, and cardiovascular …",2023-09-20T16:30:00Z,"wilmington, delaware, united states, sept 20, 2023 (globe newswire) -- transparency market research inc - the global pet-ct scanner devices market is projected to flourish at a cagr of 31% from 20… [+7009 chars]"
globenewswire,global market insights inc,"atherectomy devices market to hit usd 14 billion by 2032, says global market insights inc",atherectomy devices industry is projected to witness a cagr of 7% during the period 2023-2032 this growth can be attributed to the increase in preference for minimally invasive procedures atherectomy devices industry is projected to witness a cagr of 7% dur…,2023-10-02T21:30:00Z,"selbyville, delaware, oct 02, 2023 (globe newswire) -- atherectomy devices market size is expected to be worth usd 14 billion by 2032 the increasing awareness about the importance of early det… [+5546 chars]"
globenewswire,consegic business intelligence private limited,stethoscope market to hit us$ 91633 million by 2030 | new research update,"consegic business intelligence analyzes that the stethoscope market is growing with a cagr of 64% during the forecast period (2023-2030), boosted by the increasing incidence of cardiovascular and respiratory diseases is accelerating the demand for stethoscop…",2023-09-18T10:00:00Z,"new york, sept 18, 2023 (globe newswire) -- the global s tethoscope m arket is expected to witness significant growth at a cagr of 64% during the forecast period of 2023-2030 factors such as… [+12019 chars]"
globenewswire,research and markets,"global ppg biosensors market 2023-2030: rising cardiovascular disorders drive demand for ppg biosensors: insights from ams-osram, fitbit and analog devices","dublin, sept 22, 2023 (globe newswire) -- the ""global ppg biosensors market by product, application, distribution, end use - cumulative impact of covid-19, russia ukraine conflict, and high inflation - forecast 2023-2030"" report has been added to researchand…",2023-09-22T10:53:00Z,"dublin, sept 22, 2023 (globe newswire) -- the ""global ppg biosensors market by product, application, distribution, end use - cumulative impact of covid-19, russia ukraine conflict, and high inflatio… [+5682 chars]"
globenewswire,spherical insights llp,global nanomedicine market size to grow usd 56415 billion by 2032 | cagr of 124%,"the global nanomedicine market size was valued at usd 17413 billion in 2022 and the worldwide nanomedicine market size is expected to reach usd 56415 billion by 2032, according to a research report published by spherical insights & consulting companies cov…",2023-09-18T10:30:00Z,"new york, united states , sept 18, 2023 (globe newswire) -- the global nanomedicine market size is to grow from usd 17413 billion in 2022 to usd 56415 billion by 2032, at a compound annual growth … [+11777 chars]"
globenewswire,datahorizzon research,remote patient monitoring market to reach usd 5059 billion by 2032 | cagr: 248% | datahorizzon research,"fort collins, colorado, sept 19, 2023 (globe newswire) -- datahorizzon research published a report titled, ""remote patient monitoring market size, trends, growth, share, statistics analysis report, by product (software & services and devices), by application…",2023-09-19T12:10:00Z,"fort collins, colorado, sept 19, 2023 (globe newswire) -- datahorizzon research published a report titled, ""remote patient monitoring market size, trends, growth, share, statistics analysis report, … [+8455 chars]"
globenewswire,brainy insights pvt ltd,"thrombectomy devices market size to surpass usd 27 billion growth by 2032, exhibit a cagr of 59% | rising prevalence of cardiovascular diseases",the thrombectomy devices market size is anticipated to grow from usd 152 billion in 2022 to usd 27 billion in 10 years the market ought to witness a positive growth rate owing to increasing demand for thrombectomy devices for treating cardiovascular diseas…,2023-10-02T17:00:00Z,"newark, oct 02, 2023 (globe newswire) -- the brainy insights estimates that the global thrombectomy devices market will grow from usd 152 billion in 2022 to usd 27 billion by 2032 the covid-19 pa… [+11354 chars]"
globenewswire,research nester,"albumin market revenue to cross usd 10 billion by 2035, says research nester","prominent albumin market players include apotex inx, octapharma ag, bio med international pvt ltd, baxter, novozymes, mitsubishi tanabe pharma america inc, merck kgaa, akron biotech, thermo fisher scientific, and grifols, sa prominent albumin market pla…",2023-10-02T10:30:00Z,"new york, oct 02, 2023 (globe newswire) -- the global albumin market size is slated to expand at ~ 6% cagr between 2023 and 2035 the market is poised to garner a revenue of usd 10 billion by the en… [+7348 chars]"
globenewswire,research and markets,"global vascular grafts market set to reach $59 billion by 2030, fueled by rising cardiovascular disease cases","dublin, oct 02, 2023 (globe newswire) -- the ""vascular grafts - global strategic business report"" report has been added to researchandmarketscom's offering",2023-10-02T13:33:00Z,"dublin, oct 02, 2023 (globe newswire) -- the ""vascular grafts - global strategic business report"" report has been added to researchandmarketscom's offering the global vascular grafts market is po… [+7391 chars]"
globenewswire,prophecy market insights,fractional flow reserve market surpasses us$ 22 billion by 2032 with impressive cagr growth – by pmi,"prophecy market insights latest research report on the fractional flow reserve market provides a comprehensive analysis of the current market scenario, growth opportunities, challenges, and emerging trends the report offers insights into the market's size an…",2023-10-09T13:30:00Z,"covina, oct 09, 2023 (globe newswire) -- the fractional flow reserve (ffr) provides readily available, straightforward and quantitative technique to cardiologists to determine the physiologic signif… [+6270 chars]"
globenewswire,avertix medical inc,avertix and bios acquisition corporation mutually agree to terminate proposed business combination,"eatontown, nj and new york, oct 04, 2023 (globe newswire) -- avertix medical, inc (“avertix” or the “company”), formerly known as angel medical systems, inc, a company focused on improving long-term management and outcomes of high-risk coronary disease…",2023-10-04T11:30:00Z,"eatontown, nj and new york, oct 04, 2023 (globe newswire) -- avertix medical, inc (avertix or the company), formerly known as angel medical systems, inc, a company focused on improving long-te… [+6025 chars]"
globenewswire,research and markets,"medical cooling systems markets: original equipment manufacturer, hospitals and clinics, diagnostic imaging centers - global forecast to 2028","dublin, sept 25, 2023 (globe newswire) -- the ""medical cooling systems market by type, application, end user (original equipment manufacturer, hospitals and clinics, diagnostic imaging centers, and others), and region 2023-2028"" report has been added to rese…",2023-09-25T10:03:00Z,"dublin, sept 25, 2023 (globe newswire) -- the ""medical cooling systems market by type, application, end user (original equipment manufacturer, hospitals and clinics, diagnostic imaging centers, and … [+6973 chars]"
globenewswire,"biocardia, inc",biocardia announces completion of enrollment in phase iii cardiamp hf trial and plans for cardiamp hf trial ii,"sunnyvale, calif, oct 11, 2023 (globe newswire) -- biocardia®, inc [nasdaq: bcda], a developer of cellular and cell-derived therapeutics for the treatment of cardiovascular and pulmonary disease, today announces completion of enrollment in its cardiamp hea…",2023-10-11T10:00:00Z,"sunnyvale, calif, oct 11, 2023 (globe newswire) -- biocardia®, inc [nasdaq: bcda], a developer of cellular and cell-derived therapeutics for the treatment of cardiovascular and pulmonary disease, … [+8750 chars]"
globenewswire,visiongain reports ltd,orphan drugs market is projected to grow at a cagr of 111% by 2033: visiongain,"visiongain has published a new report entitled orphan drugs market report 2023-2033: forecasts by therapeutic area (cancer, neurological diseases, cardiovascular diseases, hematologic disorders, infectious diseases, metabolic diseases, others), by drug type (…",2023-10-05T14:21:00Z,"visiongain has published a new report entitled orphan drugs market report 2023-2033: forecasts by therapeutic area (cancer, neurological diseases, cardiovascular diseases, hematologic disorders, infe… [+10722 chars]"
globenewswire,acumen research and consulting,"atherosclerosis drugs market size is expected to reach usd 269 billion by 2032, registering a cagr of 28% from 2023 to 2032","acumen research and consulting recently published report titled “atherosclerosis drugs market forecast, 2023 - 2032” acumen research and consulting recently published report titled “atherosclerosis drugs market forecast, 2023 - 2032”",2023-10-02T15:00:00Z,"newyork, oct 02, 2023 (globe newswire) -- the atherosclerosis drugs market is at the forefront of medical innovation, offering advanced therapeutic solutions for the growing global burden of cardiov… [+8733 chars]"
globenewswire,research nester,"robotic rehabilitation and assistive technologies market revenue to hit usd 8 billion by 2033, says research nester","major robotic rehabilitation and assistive technologies market players include rewalk robotics, alterg, inc, bionik laboratories corp, ekso bionics, vincent medical, dih technologies corporation (hocoma), cyberdyne, inc, kinova inc, rex bionics ltd, and …",2023-09-13T09:00:00Z,"new york, sept 13, 2023 (globe newswire) -- the global robotic rehabilitation and assistive technologies market size is expected to expand at ~14% cagr from 2023 to 2033 the market is anticipated t… [+11875 chars]"
globenewswire,prophecy market insights,"protein expression systems market; the biopharmaceutical industry's expanding demand for recombinant proteins, monoclonal antibodies, and therapeutic proteins is a major driver to fuel protein expression systems market growth-by pmi","prophecy market insights latest research report on the protein expression systems market provides a comprehensive analysis of the current market scenario, growth opportunities, challenges, and emerging trends the report offers insights into the market's size…",2023-09-20T17:00:00Z,"covina, sept 20, 2023 (globe newswire) -- protein expression is the method in which proteins are synthesized, modified and regulated in living organisms or also used in manufacturing of proteins ye… [+6234 chars]"
globenewswire,research and markets,global cardiac holter monitor market report 2023-2030: dominance of 1-channel cardiac holter monitors gains momentum as affordability meets accuracy,"dublin, sept 19, 2023 (globe newswire) -- the ""cardiac holter monitor market, size, global forecast 2023-2030, industry trends, share, growth, insight, impact of inflation, company analysis"" report has been added to researchandmarketscom's offeringglobal c…",2023-09-19T08:28:00Z,"dublin, sept 19, 2023 (globe newswire) -- the ""cardiac holter monitor market, size, global forecast 2023-2030, industry trends, share, growth, insight, impact of inflation, company analysis"" report … [+7956 chars]"
globenewswire,research and markets,global renal denervation market report 2023-2028: funding boosts research and market expansion with united states dominating,"dublin, sept 13, 2023 (globe newswire) -- the ""renal denervation market - global industry size, share, trends, opportunity, and forecast, 2018-2028 segmented by technology, by product, by therapeutic area, by end user, by region and competition"" report has b…",2023-09-13T08:08:00Z,"dublin, sept 13, 2023 (globe newswire) -- the ""renal denervation market - global industry size, share, trends, opportunity, and forecast, 2018-2028 segmented by technology, by product, by therapeuti… [+4934 chars]"
globenewswire,zion market research,"global cardiac arrest treatment market: forecasted growth to reach usd 83 billion by 2030, at a cagr of 45%","[228 + pages report] according to a market research study published by zion market research, the demand analysis of global cardiac arrest treatment market size & share revenue was valued at around usd 5 billion in 2022 and is estimated to grow about usd 83 b…",2023-10-02T21:29:00Z,"new york, united states, oct 02, 2023 (globe newswire) -- zion market research has published a new research report titled cardiac arrest treatment market by treatment (drugs [vasopressors, anti-arrh… [+16144 chars]"
pr newswire uk,,how artificial intelligence is bolstering impressive billion dollar growth opportunities in healthcare sector,"financialnewsmediacom news commentary palm beach, fla, sept 12, 2023 /prnewswire/ -- artificial intelligence (ai) and machine learning (ml) algorithms are being widely adopted and integrated into healthcare systems to accurately predict diseases in their e…",2023-09-12T12:45:00Z,"financialnewsmediacom news commentary palm beach, fla, sept 12, 2023 /prnewswire/ -- artificial intelligence (ai) and machine learning (ml) algorithms are being widely adopted and integrated in… [+11625 chars]"
globenewswire,brainy insights pvt ltd,biomaterials market size to surpass usd 63896 billion growth by 2032 | the growing cases of musculoskeletal and chronic skeletal medical conditions,"according to the brainy insights, the global biomaterials market size is projected to reach usd 63896 billion by 2032 from its value of usd 16254 million in 2022, at a cagr of 1467% during the forecast period growing adoption of technologically advanced r…",2023-10-11T21:00:00Z,"newark, oct 11, 2023 (globe newswire) -- as per the report published by the brainy insights, the global biomaterials market is expected to grow from usd 16254 billion in 2022 to usd 63896 billion … [+7999 chars]"
globenewswire,research nester,"medical adhesives tape market revenue to reach usd 15 billion by 2035, says research nester","prominent medical adhesives tape market players include smith & nephew plc, 3m, medline industries inc, paul hartmann ag, cardinal health, baxter international, inc, johnson & johnson services, inc, nitto denko corporation, lohmann gmbh & co kg, and merid…",2023-10-02T11:30:00Z,"new york, oct 02, 2023 (globe newswire) -- the global medical adhesives tape market size is slated to expand at ~6% cagr between 2023 and 2035 the market is poised to garner a revenue of usd 15 bil… [+6714 chars]"
globenewswire,research and markets,"global cardiac marker analyzer market research and forecasts report 2022-2023 & 2028: product analysis, companies business & marketing strategy, major deals, covid-19 impacts","dublin, sept 21, 2023 (globe newswire) -- the ""global cardiac marker analyzer market and forecast, impact of covid-19, product analysis, companies business & marketing strategy, major deals"" report has been added to researchandmarketscom's offering",2023-09-21T08:43:00Z,"dublin, sept 21, 2023 (globe newswire) -- the ""global cardiac marker analyzer market and forecast, impact of covid-19, product analysis, companies business &amp; marketing strategy, major deals"" rep… [+5503 chars]"
globenewswire,research and markets,specialty clinics emerge as key end-users in the global angina pectoris drugs market 2023-2030,"dublin, sept 20, 2023 (globe newswire) -- the ""global angina pectoris drugs market by type, drugs, route of administration, end-users - cumulative impact of covid-19, russia ukraine conflict, and high inflation - forecast 2023-2030"" report has been added to …",2023-09-20T10:23:00Z,"dublin, sept 20, 2023 (globe newswire) -- the ""global angina pectoris drugs market by type, drugs, route of administration, end-users - cumulative impact of covid-19, russia ukraine conflict, and hi… [+5888 chars]"
prnewswire,,diagnostic imaging market worth $346 billion | marketsandmarkets,"chicago, sept 18, 2023 /prnewswire/ -- the diagnostic imaging industry is poised for remarkable advancements in the near future, driven by groundbreaking technologies and evolving healthcare needs artificial intelligence and machine learning algorithms will…",2023-09-18T10:30:00Z,"chicago, sept 18, 2023 /prnewswire/ -- the diagnostic imaging industry is poised for remarkable advancements in the near future, driven by groundbreaking technologies and evolving healthcare needs … [+11295 chars]"
globenewswire,canon medical systems usa,canon medical introduces alphenix sky 12 hd interventional system with the new 12”×12” high-definition (hi-def) detector,providing the highest spatial resolution in the market to help clinicians see fine details providing the highest spatial resolution in the market to help clinicians see fine details,2023-09-12T12:00:00Z,"tustin california, sept 12, 2023 (globe newswire) -- tustin, ca, usa, 12th of september 2023 continuing its focus on providing clinicians with clarity and precision during interventional procedures… [+3826 chars]"
globenewswire,"altimmune, inc",altimmune announces completion of dosing in the phase 2 momentum trial of pemvidutide in subjects with obesity or overweight,top-line 48-week results from the trial expected q4 2023 top-line 48-week results from the trial expected q4 2023,2023-09-12T11:30:00Z,"gaithersburg, md, sept 12, 2023 (globe newswire) -- altimmune, inc (nasdaq: alt), a clinical-stage biopharmaceutical company, today announced the completion of dosing (last subject last dose) in i… [+5464 chars]"
globenewswire,research and markets,"key trends shaping the future of the global hospital market: digital health, patient-centric care, and specialized hospitals","dublin, sept 13, 2023 (globe newswire) -- the ""global hospital market report and forecast 2023-2031"" report has been added to researchandmarketscom's offering",2023-09-13T09:43:00Z,"dublin, sept 13, 2023 (globe newswire) -- the ""global hospital market report and forecast 2023-2031"" report has been added to researchandmarketscom's offering the global hospital market is poised… [+7093 chars]"
globenewswire,research and markets,"united states digital health market insights & forecast report 2023-2027: mhealth emerges as fastest-growing segment - focus on apps, chronic diseases, && ehr","dublin, oct 11, 2023 (globe newswire) -- the ""us digital health market (by technology & component): insights & forecast with potential impact of covid-19 (2023-2027)"" report has been added to researchandmarketscom's offering",2023-10-11T09:03:00Z,"dublin, oct 11, 2023 (globe newswire) -- the ""us digital health market (by technology &amp; component): insights &amp; forecast with potential impact of covid-19 (2023-2027)"" report has been added t… [+5476 chars]"
fdagov,fda,"moorish science temple, the divine and national movement of north america, inc; #13 the moorish american national republic dba moor herbs, inc - 655674 - 08/01/2023",unapproved new drugs/misbranded,2023-09-19T13:21:05Z,"delivery method: via email and united parcel service product: drugs recipient: maria s lemay-bey, owner moorish science temple, the divine and national movement of north america, inc; #13 th… [+36055 chars]"
marketscreenercom,globenewswire,microbot medical engages cro to support its upcoming us pivotal clinical trial,"(marketscreenercom) the engagement is an additional step in the company's path towards marketing clearance with the fdabraintree, mass, sept 27, 2023 -- microbot medical inc , the developer of the liberty® robotic surgical system, the first single-use end…",2023-09-27T12:31:02Z,"the engagement is an additional step in the company's path towards marketing clearance with the fda braintree, mass, sept 27, 2023 (globe newswire) -- microbot medical inc (nasdaq: mbot), the dev… [+4800 chars]"
globenewswire,research and markets,"$4 billion digital radiology market - global industry trends, share, size, growth, opportunity and forecast 2023-2028","dublin, sept 20, 2023 (globe newswire) -- the ""digital radiology market: global industry trends, share, size, growth, opportunity and forecast 2023-2028"" report has been added to researchandmarketscom's offering",2023-09-20T09:08:00Z,"dublin, sept 20, 2023 (globe newswire) -- the ""digital radiology market: global industry trends, share, size, growth, opportunity and forecast 2023-2028"" report has been added to researchandmarkets… [+4878 chars]"
globenewswire,research and markets,"autotransfusion devices revolutionize surgical procedures, enabling patients to become their own blood donors","dublin, oct 06, 2023 (globe newswire) -- the ""global autotransfusion devices market (by type, application, end user & region): insights and forecast with potential impact of covid-19 (2022-2027)"" report has been added to researchandmarketscom's offering",2023-10-06T11:18:00Z,"dublin, oct 06, 2023 (globe newswire) -- the ""global autotransfusion devices market (by type, application, end user &amp; region): insights and forecast with potential impact of covid-19 (2022-2027)… [+3552 chars]"
