source,author,title,description,publishedAT,content
globenewswire,research and markets,global lymphedema treatment market: promising growth ahead with projected valuation of $174 billion by 2030,"dublin, sept 25, 2023 (globe newswire) -- the ""global lymphedema treatment market size, share, growth analysis, by end-user, by product, by condition type, by treatment type - industry forecast 2023-2030"" report has been added to researchandmarketscom's off…",2023-09-25T09:03:00Z,"dublin, sept 25, 2023 (globe newswire) -- the ""global lymphedema treatment market size, share, growth analysis, by end-user, by product, by condition type, by treatment type - industry forecast 2023… [+4195 chars]"
globenewswire,emergen research,global surgical ablation market size to reach usd 1191 billion in 2032 | emergen research,increasing prevalence of chronic diseases is a key factor driving market revenue growth increasing prevalence of chronic diseases is a key factor driving market revenue growth,2023-09-13T14:00:00Z,"vancouver, sept 13, 2023 (globe newswire) -- the global surgical ablation market size was usd 614 billion in 2022 and is expected to register a steady revenue cagr of 68% during the forecast per… [+11605 chars]"
globenewswire,research and markets,global medical mems market to reach $377 billion by 2030: minimally invasive procedures drive growth,"dublin, sept 22, 2023 (globe newswire) -- the ""global medical mems market size, share, and growth analysis by sensor type, application, end-user, and region - industry forecast 2023-2030"" report has been added to researchandmarketscom's offering",2023-09-22T08:43:00Z,"dublin, sept 22, 2023 (globe newswire) -- the ""global medical mems market size, share, and growth analysis by sensor type, application, end-user, and region - industry forecast 2023-2030"" report has… [+3491 chars]"
globenewswire,research and markets,global cell harvesting strategic market report 2023-2030: growing use of mesenchymal stem cells in regenerative medicine to drive the cell harvesting market,"dublin, oct 09, 2023 (globe newswire) -- the ""cell harvesting - global strategic business report"" report has been added to researchandmarketscom's offeringglobal cell harvesting market to reach $4833 million by 2030the global market for cell harvesting es…",2023-10-09T10:03:00Z,"dublin, oct 09, 2023 (globe newswire) -- the ""cell harvesting - global strategic business report"" report has been added to researchandmarketscom's offering global cell harvesting market to reach … [+6048 chars]"
globenewswire,factmr,"guidewires market to surpass us$ 1,755 million at a cagr of 61% by 2033: factmr analysis",rise in the aging population globally and continuous advancements in guidewire technology are expected to boost the adoption of guidewires during the forecast period rise in the aging population globally and continuous advancements in guidewire technology ar…,2023-09-14T11:00:00Z,"rockville, sept 14, 2023 (globe newswire) -- as per factmr, a provider of market research and competitive intelligence, the global guidewires market is projected to rise at a cagr of 61% and is … [+8378 chars]"
globenewswire,research and markets,global wearable pulse oximeter report 2023-2030: market witnesses technological innovation as integrated devices gain traction,"dublin, sept 20, 2023 (globe newswire) -- the ""global wearable pulse oximeter market by product, end user, distribution - cumulative impact of covid-19, russia ukraine conflict, and high inflation - forecast 2023-2030"" report has been added to researchandmar…",2023-09-20T11:18:00Z,"dublin, sept 20, 2023 (globe newswire) -- the ""global wearable pulse oximeter market by product, end user, distribution - cumulative impact of covid-19, russia ukraine conflict, and high inflation -… [+4444 chars]"
prnewswire,,active pharmaceutical ingredients (api) market expected to reach usd 2844 billion by 2027 at a 64% cagr by 2027 | brandessence market research,"london , sept 26, 2023 /prnewswire/ -- according to a comprehensive research report by brandessence market research (bmrc), ""active pharmaceutical ingredients (api) market industry analysis, trends, and forecast 2020-2027"" the active pharmaceutical ingredie…",2023-09-26T07:13:00Z,"london , sept 26, 2023 /prnewswire/ -- according to a comprehensive research report by brandessence market research (bmrc), ""active pharmaceutical ingredients (api) market industry analysis, trends,… [+11057 chars]"
prnewswire,,global medical cooling systems market analysis report 2023-2028: from injury recovery to laser procedures - how cooling systems are shaping healthcare,"dublin, sept 21, 2023 /prnewswire/ -- the ""medical cooling systems market by type, application, end user (original equipment manufacturer, hospitals and clinics, diagnostic imaging centers, and others), and region 2023-2028"" report has been added to research…",2023-09-21T14:30:00Z,"dublin, sept 21, 2023 /prnewswire/ -- the ""medical cooling systems market by type, application, end user (original equipment manufacturer, hospitals and clinics, diagnostic imaging centers, and othe… [+6898 chars]"
globenewswire,research and markets,global multiplex assays market 2023-2027: r&d applications of multiplex assays dominate - aiding drug discovery and biomarker validation,"dublin, oct 11, 2023 (globe newswire) -- the ""global multiplex assays market by product & service (consumables, instruments, software & services), type (nucleic acid, protein), technology (flow cytometry, luminescence), application (r&d, diagnosis), end user…",2023-10-11T12:08:00Z,"dublin, oct 11, 2023 (globe newswire) -- the ""global multiplex assays market by product &amp; service (consumables, instruments, software &amp; services), type (nucleic acid, protein), technology (f… [+6293 chars]"
globenewswire,research and markets,"environmental sustainability and technological advancements drive electric aircraft market to over $95 billion in 2023, with strong growth expected through 2033","dublin, sept 15, 2023 (globe newswire) -- the ""ai-enabled drug discovery and clinical trials market report 2023-2033"" report has been added to researchandmarketscom's offering",2023-09-15T08:13:00Z,"dublin, sept 15, 2023 (globe newswire) -- the ""ai-enabled drug discovery and clinical trials market report 2023-2033"" report has been added to researchandmarketscom's offering the global ai-enabl… [+5854 chars]"
prnewswire,,global and regional rare disease genetic testing market report 2023-2033: early detection demand and innovative systems usher in new era for rare disease genetic testing,"dublin, oct 3, 2023 /prnewswire/ -- the ""rare disease genetic testing market - a global and regional analysis: focus on disease type, offering, specialty type, sample type, trait type, technology, age group, end user, and country analysis - analysis and fore…",2023-10-03T09:45:00Z,"dublin, oct 3, 2023 /prnewswire/ -- the ""rare disease genetic testing market - a global and regional analysis: focus on disease type, offering, specialty type, sample type, trait type, technology, a… [+10700 chars]"
globenewswire,research and markets,navigating the us$4261 billion medical imaging equipment market: key drivers and trends unveiled,"dublin, oct 06, 2023 (globe newswire) -- the ""global medical imaging equipment market (by product, end user & region): insights and forecast with potential impact of covid-19 (2022-2026)"" report has been added to researchandmarketscom's offering",2023-10-06T11:28:00Z,"dublin, oct 06, 2023 (globe newswire) -- the ""global medical imaging equipment market (by product, end user &amp; region): insights and forecast with potential impact of covid-19 (2022-2026)"" report… [+3580 chars]"
globenewswire,cmi market research private limited,"[latest] global antibacterial drugs market size/share worth usd 679 billion by 2032 at a 56% cagr: custom market insights (analysis, outlook, leaders, report, trends, forecast, segmentation, growth, growth rate, value)","[220+ pages latest report] according to a market research study published by custom market insights, the demand analysis of global antibacterial drugs market size & share revenue was valued at approximately usd 5155 billion in 2022 and is expected to reach u…",2023-09-25T21:00:00Z,"austin, tx, usa, sept 26, 2023 (globe newswire) -- custom market insights has published a new research report titled antibacterial drugs market size, trends and insights by drug class (cephalosporin… [+23615 chars]"
globenewswire,marketsandmarkets research pvt ltd,biotechnology contract manufacturing market is expected to reach $248 billion | marketsandmarkets,"chicago, sept 22, 2023 (globe newswire) -- in the near future, the biotechnology contract manufacturing industry is poised to undergo a transformative evolution, fueled by rapid advances in genetic engineering, personalized medicine, and pharmaceutical innov…",2023-09-22T12:30:00Z,"chicago, sept 22, 2023 (globe newswire) -- in the near future, the biotechnology contract manufacturing industry is poised to undergo a transformative evolution, fueled by rapid advances in genetic … [+10955 chars]"
globenewswire,research and markets,healthcare and homeland security drive the demand: scintillators emerge as the preferred choice in radiation detection,"dublin, sept 20, 2023 (globe newswire) -- the ""scintillator market: global industry trends, share, size, growth, opportunity and forecast 2023-2028"" report has been added to researchandmarketscom's offering",2023-09-20T13:33:00Z,"dublin, sept 20, 2023 (globe newswire) -- the ""scintillator market: global industry trends, share, size, growth, opportunity and forecast 2023-2028"" report has been added to researchandmarketscom's… [+5090 chars]"
marketscreenercom,business wire,better therapeutics completes enrollment in real-world evidence program evaluating long-term effectiveness of aspyrerx in type 2 diabetes,"(marketscreenercom) 1,000 participants enrolled across two studies, and six sites studies will evaluate clinical effectiveness beyond 6 months, impact on medication use and healthcare utilization https://wwwmarketscreenercom/quote/stock/better-therapeu…",2023-09-28T20:19:02Z,"1,000 participants enrolled across two studies, and six sites studies will evaluate clinical effectiveness beyond 6 months, impact on medication use and healthcare utilization better therapeutics, … [+8756 chars]"
globenewswire,precedence research,clinical trial supplies market size will reach usd 49 bn by 2032,"according to precedence research, the clinical trial supplies market is expected to grow at an 651% cagr from 2023 to 2023, reaching usd 49 billion by 2032 according to precedence research, the clinical trial supplies market is expected to grow at an 651%…",2023-10-03T11:23:00Z,"ottawa, oct 03, 2023 (globe newswire) -- the global clinical trial supplies market was valued at usd 261 billion in 2022 the major factors driving the growth of the clinical trial supplies market … [+10101 chars]"
globenewswire,vantage market research,life sciences tools market size & share to surpass $3281 billion by 2030 | vantage market research,"washington, sept 22, 2023 (globe newswire) -- as per vantage market research, the life sciences tools market has witnessed significant growth in recent years due to technological advancements and increasing investments in research and development activities…",2023-09-22T11:35:00Z,"washington, sept 22, 2023 (globe newswire) -- as per vantage market research, the life sciences tools market has witnessed significant growth in recent years due to technological advancements and in… [+17218 chars]"
marketscreenercom,prnewswire,cvs health appoints michael f mahoney to its board of directors,"(marketscreenercom) woonsocket, ri, sept 21, 2023 /prnewswire/ -- cvs health corporation has appointed michael f mahoney, chairman and ceo of boston scientific corporation , a global medical technology leader, to serve on the board of directors of cvs …",2023-09-21T10:46:03Z,"woonsocket, ri, sept 21, 2023 /prnewswire/ -- cvs health corporation (nyse: cvs) has appointed michael f mahoney, chairman and ceo of boston scientific corporation (nyse: bsx), a global medical t… [+3665 chars]"
globenewswire,research and markets,revolutionizing point-of-care imaging: exploring the global handheld ultrasound market's growth trajectory,"dublin, oct 04, 2023 (globe newswire) -- the ""handheld ultrasound market: global industry analysis, trends, market size, and forecasts up to 2030"" report has been added to researchandmarketscom's offering",2023-10-04T09:33:00Z,"dublin, oct 04, 2023 (globe newswire) -- the ""handheld ultrasound market: global industry analysis, trends, market size, and forecasts up to 2030"" report has been added to researchandmarketscom's o… [+4053 chars]"
prnewswire,,neurocrine biosciences announces phase 3 pediatric study results of crinecerfont in children and adolescents for the treatment of congenital adrenal hyperplasia met primary and key secondary endpoints,cahtalyst™ pediatric study met primary endpoint demonstrating a statistically significant decrease from baseline in serum androstenedione in children and adolescents with congenital adrenal hyperplasia key secondary endpoint demonstrated a statistically signi…,2023-10-05T11:00:00Z,<ul><li>cahtalyst pediatric study met primary endpoint demonstrating a statistically significant decrease from baseline in serum androstenedione in children and adolescents with congenital adrenal hy… [+13811 chars]
pr newswire uk,,"holter monitor market to reach $120 billion by 2029, 3-channel type monitors expected to make the most substantial contribution to market share - arizton","chicago, oct 10, 2023 /prnewswire/ -- according to arizton's latest research report, the holter monitor market growing at a cagr of 845% during 2023-2029 the report analyses the current state of the global holter monitor market and its market dynamics from…",2023-10-10T18:50:00Z,"chicago, oct 10, 2023 /prnewswire/ -- according to arizton's latest research report, the holter monitor market growing at a cagr of 845% during 2023-2029 the report analyses the current state o… [+9221 chars]"
globenewswire,marketus,"connected drug delivery devices market set to reach usd 2,9809 million by 2032, fueled by personalized medicine trends","the rising popularity of connected drug delivery devices is driving the growth in demand for home healthcare these devices provide convenience and user-friendliness, making them a preferred choice for elderly individuals who wish to manage their medical cond…",2023-10-09T13:38:00Z,"new york, oct 09, 2023 (globe newswire) -- according to a recent report by marketus, the global connected drug delivery devices market size is expected to be worth around usd 2,9809 million by 203… [+13461 chars]"
marketscreenercom,business wire,ntt research boosts scientific teams with nine new hires,(marketscreenercom) distinguished researcher timothée leleu and several strategic hires add to ntt researchs growing team https://wwwmarketscreenercom/quote/stock/nippon-telegraph-and-tele-6492476/news/ntt-research-boosts-scientific-teams-with-nine-new-…,2023-09-26T12:16:02Z,"distinguished researcher timothée leleu and several strategic hires add to ntt researchs growing team ntt research, inc, a division of ntt (tyo:9432), today announced that it has named timothée lel… [+9813 chars]"
globenewswire,microbot medical inc,microbot medical engages cro to support its upcoming us pivotal clinical trial,the engagement is an additional step in the company's path towards marketing clearance with the fda the engagement is an additional step in the company's path towards marketing clearance with the fda,2023-09-27T12:30:00Z,"braintree, mass, sept 27, 2023 (globe newswire) -- microbot medical inc (nasdaq: mbot), the developer of the liberty® robotic surgical system, the first single-use endovascular robotic system, ann… [+4699 chars]"
marketscreenercom,business wire,ge healthcare and university hospitals enter 10-year strategic collaboration to contemporize its imaging fleet and implement enterprise digital solutions to help improve patient care and optimize processes,"(marketscreenercom) technology-powered collaboration aims to deliver ai-enabled devices and digital solutions at the enterprise level to increase clinical and operational efficiencies, drive workflow enhancements and improve patient outcomes https://www…",2023-10-05T14:03:02Z,"technology-powered collaboration aims to deliver ai-enabled devices and digital solutions at the enterprise level to increase clinical and operational efficiencies, drive workflow enhancements and im… [+6862 chars]"
globenewswire,datahorizzon research,telemedicine market size to reach usd 4535 billion by 2032 cagr: 179% report by datahorizzon research,"according to datahorizzon research, the telemedicine market size was usd 880 billion in 2022 and is anticipated to be usd 4535 billion by 2032 at a cagr of 179% according to datahorizzon research, the telemedicine market size was usd 880 billion in 2022 …",2023-10-01T23:30:00Z,"fort collins, colorado, oct 01, 2023 (globe newswire) -- datahorizzon research published a report titled, ""telemedicine market size, share, trends, growth, statistics analysis report, by type (produ… [+11731 chars]"
globenewswire,"orchestra biomed holdings, inc",orchestra biomed granted fda approval of ide to initiate backbeat pivotal study of backbeat cnt™ for the treatment of hypertension in pacemaker patients,"new hope, pa, sept 19, 2023 (globe newswire) -- orchestra biomed holdings, inc (nasdaq: obio) (“orchestra biomed” or the “company”), a biomedical company accelerating high-impact technologies to patients through risk-reward sharing partnerships, today anno…",2023-09-19T11:30:00Z,"<ul><li>hypertension is the most common comorbidity in the pacemaker population, affecting over 70% of patients or approximately 750,000 people annually worldwide</li><li>medtronic plc and orchestra … [+13496 chars]"
globenewswire,future market insights global and consulting pvt ltd,"contrast media injectors market projected to reach us$ 30 billion by 2033, rising at a 66% cagr | future market insights",the united states dominates the contrast media injectors market owing to favorable reimbursement policies and a higher percentage of the aging population in the country the united states dominates the contrast media injectors market owing to favorable reimbu…,2023-09-25T12:30:00Z,"newark, del, sept 25, 2023 (globe newswire) -- according to a recent market study by future market insights (fmi), the global contrast media injectors market is expected to thrive at a 66% cagr, re… [+7980 chars]"
marketscreenercom,newsfilecorp,advanced health intelligence ltd selected as finalist for singapore ministry of health project,(marketscreenercom) advanced health intelligence ltd is proud to announce its selection from 163 registrations from 28 countries as a finalist in the prestigious 2023 innomatch program singapore's healthcare innomatch is a platform that seeks to accelerate …,2023-09-13T11:35:01Z,highlights <ul><li>singapore's centre for healthcare innovation and temasek foundation has selected ahi as a finalist for singapore's healthcare innomatch program </li></ul><ul><li>ahi was one of 1… [+14777 chars]
globenewswire,datahorizzon research,infusion pumps market to reach usd 311 billion by 2032 cagr: 94% report by datahorizzon research,"according to datahorizzon research, the infusion pumps market size was valued at usd 128 billion in 2022 and is expected to have a market size of usd 311 billion by 2032 with a cagr of 94% according to datahorizzon research, the infusion pumps market size…",2023-09-29T00:20:00Z,"fort collins, colorado, sept 28, 2023 (globe newswire) -- datahorizzon research published a report titled, ""infusion pumps market size, growth, share, statistics report, by type (volumetric pumps, s… [+8472 chars]"
marketscreenercom,globenewswire,regeneron and intellia announce expanded research collaboration to develop crispr-based therapies for the treatment of neurological and muscular diseases,"(marketscreenercom) collaboration combines intellias leading genome editing platform, including its proprietary nme2cas9 technology, with regenerons proprietary antibody-targeted viral vector delivery technologies to jointly advance in vivo programs outsid…",2023-10-03T11:01:02Z,"collaboration combines intellias leading genome editing platform, including its proprietary nme2cas9 technology, with regenerons proprietary antibody-targeted viral vector delivery technologies to jo… [+16183 chars]"
globenewswire,meticulous market research pvt ltd,africa ivd market to be worth $149 billion by 2030—exclusive report by meticulous research®,"africa ivd market by product & solution, technology (immunoassay, point of care, molecular diagnostics, coagulation), application (infectious diseases, diabetes, oncology), diagnostic approach (lab, otc, poc), end user - forecast to 2030 africa ivd market by …",2023-09-12T14:00:00Z,"redding, california, sept 12, 2023 (globe newswire) -- according to a new market research report titled, africa in vitro diagnostics market by product &amp; solution, technology (immunoassay, poin… [+12055 chars]"
globenewswire,emergen research,global cell expansion market to reach value of usd 7993 billion by 2032 | emergen research,rise in research and development activities across the globe is driving the demand for cell expansion market rise in research and development activities across the globe is driving the demand for cell expansion market,2023-10-09T12:48:00Z,"vancouver, oct 09, 2023 (globe newswire) -- the global cell expansion market is estimated to reach value of usd 7993 billion by 2032, according to a current analysis by emergen research cell exp… [+10310 chars]"
globenewswire,coherent market insights pvt ltd,real-world data (rwd) market to reach $407 billion by 2030: coherent market insights,"real-world data (rwd) refers to information derived from sources outside the realm of conventional clinical trials, gaining growing significance in contemporary healthcare decision-making processes real-world data (rwd) refers to information derived from sou…",2023-10-06T12:18:00Z,"burlingame, oct 06, 2023 (globe newswire) -- according to coherent market insights, global real-world data (rwd) market is estimated to be valued at us$ 159 billion in 2023 and is expected to exhib… [+9821 chars]"
prnewswire,,"patient temperature monitoring market poised to reach $122 billion by 2030 with 96% cagr, fueled by technological advancements","dublin, oct 3, 2023 /prnewswire/ -- the ""patient temperature monitoring - global strategic business report"" report has been added to researchandmarketscom's offering the global market for patient temperature monitoring, estimated at us$58 billion in 2022,…",2023-10-03T22:30:00Z,"dublin, oct 3, 2023 /prnewswire/ -- the ""patient temperature monitoring - global strategic business report"" report has been added to researchandmarketscom's offering the global market for patien… [+10214 chars]"
globenewswire,research and markets,"endoscopes and cardiac surgery lead growth in the image guided surgery devices market, expected cagr of 42%","dublin, oct 02, 2023 (globe newswire) -- the ""image guided surgery devices - global strategic business report"" report has been added to researchandmarketscom's offering",2023-10-02T13:23:00Z,"dublin, oct 02, 2023 (globe newswire) -- the ""image guided surgery devices - global strategic business report"" report has been added to researchandmarketscom's offering the global market for imag… [+9111 chars]"
globenewswire,research and markets,global home rehabilitation products and services report 2023-2030: home-based cardiac and pulmonary rehabilitation - a growing trend in healthcare,"dublin, oct 03, 2023 (globe newswire) -- the ""home rehabilitation products and services - global strategic business report"" report has been added to researchandmarketscom's offering",2023-10-03T09:53:00Z,"dublin, oct 03, 2023 (globe newswire) -- the ""home rehabilitation products and services - global strategic business report"" report has been added to researchandmarketscom's offering the global ho… [+6475 chars]"
globenewswire,research and markets,expanding offshore manufacturing and regulatory changes drive global growth in medical device contract manufacturing market to 2028,"dublin, oct 04, 2023 (globe newswire) -- the ""medical device contract manufacturing market - global industry size, share, trends, opportunity, and forecast, 2018-2028f"" report has been added to researchandmarketscom's offering",2023-10-04T10:08:00Z,"dublin, oct 04, 2023 (globe newswire) -- the ""medical device contract manufacturing market - global industry size, share, trends, opportunity, and forecast, 2018-2028f"" report has been added to rese… [+5408 chars]"
globenewswire,transparency market research,"pharmaceutical contract sales outsourcing [cso] market is predicted to witness a value of us$ 147 billion by 2031: transparency market research, inc",advanced reporting and analytics capabilities of csos enable pharmaceutical companies to gain actionable insights into market performance and customer behavior advanced reporting and analytics capabilities of csos enable pharmaceutical companies to gain actio…,2023-09-20T13:09:00Z,"wilmington, delaware, united states, sept 20, 2023 (globe newswire) -- the pharmaceutical contract sales outsourcing [cso] market was estimated to have acquired us$ 69 billion in 2020 it is antic… [+10047 chars]"
