source,author,title,description,publishedAT,content
prnewswire,,mems technology revolutionizes healthcare: advancements in sensor types and applications,"dublin, sept 21, 2023 /prnewswire/ -- the ""global medical mems market size, share, and growth analysis by sensor type, application, end-user, and region - industry forecast 2023-2030"" report has been added to researchandmarketscom's offering the global med…",2023-09-21T10:30:00Z,"dublin, sept 21, 2023 /prnewswire/ -- the ""global medical mems market size, share, and growth analysis by sensor type, application, end-user, and region - industry forecast 2023-2030"" report has bee… [+3862 chars]"
globenewswire,transparency market research,"global generic injectables market is anticipated to reach us$ 3077 billion by 2031, rising at a 123% cagr: tmr report","the expansion of telemedicine services has increased the need for accessible injectable medications, providing an avenue for generic injectables' growth the expansion of telemedicine services has increased the need for accessible injectable medications, provi…",2023-09-20T13:16:00Z,"wilmington, delaware, united states, sept 20, 2023 (globe newswire) -- the generic injectables market was estimated to have acquired us$ 858 billion in 2020 it is anticipated to register a 123% … [+10590 chars]"
globenewswire,research and markets,"asia pacific artificial heart market research report 2023: clinical trials, market drivers, competition and forecasts to 2028","dublin, sept 15, 2023 (globe newswire) -- the ""asia pacific artificial heart market - industry size, share, trends, opportunity, and forecast, 2018-2028f segmented by type (ventricular assist device, total artificial heart, others), by power source (interna…",2023-09-15T12:13:00Z,"dublin, sept 15, 2023 (globe newswire) -- the ""asia pacific artificial heart market - industry size, share, trends, opportunity, and forecast, 2018-2028f segmented by type (ventricular assist devic… [+7250 chars]"
globenewswire,the insight partners,procedure trays market worth $4592 billion by 2030 - exclusive report by the insight partners,global procedure trays market is growing at a cagr of 99% during 2022 to 2030 global procedure trays market is growing at a cagr of 99% during 2022 to 2030,2023-09-13T13:04:00Z,"pune, india, sept 13, 2023 (globe newswire) -- a procedure tray is defined as set of prepackaged medical devices that are designed to provide the disposable materials that are used in a surgical pro… [+11048 chars]"
globenewswire,meticulous market research pvt ltd,europe pharmaceutical contract development and manufacturing market to be worth $6812 billion by 2030- exclusive report by meticulous research®,"europe pharmaceutical contract development and manufacturing market by service {manufacturing [api, fdf (parenteral, tablet, capsule, oral liquid)], drug development, biologics manufacturing, packaging}, end user [large pharma, generic] - forecast to 2030 eur…",2023-09-18T14:00:00Z,"redding, california, sept 18, 2023 (globe newswire) -- according to a new market research report, europe pharmaceutical contract development and manufacturing market by service {manufacturing [api… [+12542 chars]"
globenewswire,emergen research,global contract research organization (cro) market size to reach usd 15229 billion in 2030 | emergen research,increasing number of drug development projects across the globe is a key factor driving contract research organization market revenue growth increasing number of drug development projects across the globe is a key factor driving contract research organization…,2023-09-18T15:00:00Z,"vancouver, sept 18, 2023 (globe newswire) -- the global contract research organization (cro) market size was usd 6121 billion in 2021 and is expected to register a revenue cagr of 108% during … [+12892 chars]"
globenewswire,marketus,"surgical sutures market projected to achieve 56% cagr, synthetic segment leading revenue generation, according to marketus","new york, sept 13, 2023 (globe newswire) -- according to a recent report by marketus, the global surgical sutures market size is expected to be worth around usd 80 billion by 2032 from usd 47 billion in 2022, growing at a cagr of 56% during the forecast …",2023-09-13T13:45:00Z,"new york, sept 13, 2023 (globe newswire) -- according to a recent report by marketus, the global surgical sutures market size is expected to be worth around usd 80 billion by 2032 from usd 47 bil… [+14899 chars]"
globenewswire,emergen research,global exosomes market size to reach usd 308 billion in 2032 | emergen research,"increasing prevalence of cancer and improved exosome separation, characterization, and component detection methods are key factors driving exosomes market revenue growth increasing prevalence of cancer and improved exosome separation, characterization, and co…",2023-09-25T11:03:00Z,"vancouver, sept 25, 2023 (globe newswire) -- the global exosomes market size reached usd 050 billion in 2021 and is expected to register a revenue cagr of 18% during the forecast period, accordin… [+14222 chars]"
globenewswire,vantage market research,label-free detection market size & share to surpass $10584 million by 2030 | vantage market research,"washington, sept 25, 2023 (globe newswire) -- as per vantage market research, the label-free detection market experiences significant growth primarily fueled by technological advancements, increasing collaboration between academic and industrial entities in …",2023-09-25T11:14:00Z,"washington, sept 25, 2023 (globe newswire) -- as per vantage market research, the label-free detection market experiences significant growth primarily fueled by technological advancements, increasin… [+20154 chars]"
marketscreenercom,alliance news,"earnings: safestyle suffers amid ""difficult"" trading conditions","(marketscreenercom) the following is a round-up of updates by london-listed companies, issued on wednesday and not separately reported by alliance news: ---------- safestyle uk plc - bradford-based retailer and manufacturer of pvcu replacement windows and do…",2023-09-27T12:12:06Z,"(alliance news) - the following is a round-up of updates by london-listed companies, issued on wednesday and not separately reported by alliance news: ---------- safestyle uk plc - bradford-based r… [+4909 chars]"
globenewswire,sns insider pvt ltd,advanced wound care market to cross usd 2281 billion by 2030 as a result of rising incidence of chronic diseases and supportive government initiatives | research by sns insider,"as per sns insiders research, the advanced wound care market is poised for continued growth due to a combination of demographic shifts, technological advancements, increased awareness, and supportive government policies as per sns insiders research, the ad…",2023-09-18T13:09:00Z,"pune, sept 18, 2023 (globe newswire) -- the sns insider report indicates that the advanced wound care market reached a valuation of usd 1135 billion in 2022 and is anticipated to achieve usd 228… [+9229 chars]"
marketscreenercom,business wire,pfizer presents new data at idweek 2023 highlighting advances in prevention and treatment of certain respiratory illnesses and other infectious diseases,(marketscreenercom) presentations showcase diversity and momentum of pfizers growing portfolio of vaccines and anti-infectives https://wwwmarketscreenercom/quote/stock/pfizer-inc-23365019/news/pfizer-presents-new-data-at-idweek-2023-highlighting-advan…,2023-10-05T20:33:01Z,presentations showcase diversity and momentum of pfizers growing portfolio of vaccines and anti-infectives pfizer inc (nyse: pfe) will present data across its infectious disease portfolio at the up… [+28620 chars]
globenewswire,brainy insights pvt ltd,[latest] point of care molecular diagnostics market size will attain usd 223 billion by 2032 growing at 108% cagr - exclusive report by the brainy insights,latest report published by the brainy insights provides analysis on point of care molecular diagnostics market size during 2023-2032 the global point of care molecular diagnostics market was valued at usd 8 billion in 2022 and is expected to reach usd 223 b…,2023-09-13T14:00:00Z,"newark, sept 13, 2023 (globe newswire) -- the brainy insights estimates that the usd 8 billion point of care molecular diagnostics market will reach usd 223 billion by 2032 point-of-care molecular… [+7903 chars]"
globenewswire,vantage market research,pharmaceutical manufacturing market size & share to surpass $8636 billion by 2030 | vantage market research,"washington, oct 10, 2023 (globe newswire) -- as per vantage market research, the pharmaceutical manufacturing market is poised for growth due to various factors, such as the increase in demand for pharmaceutical products, advancements in technology, and a ri…",2023-10-10T13:14:00Z,"washington, oct 10, 2023 (globe newswire) -- as per vantage market research, the pharmaceutical manufacturing market is poised for growth due to various factors, such as the increase in demand for p… [+18397 chars]"
prnewswire,,global cardiac holter monitor market research report 2023: a $7135 million market by 2030 - wireless and ai-integrated holter monitors transforming cardiovascular health monitoring,"dublin, sept 15, 2023 /prnewswire/ -- the ""cardiac holter monitor market, size, global forecast 2023-2030, industry trends, share, growth, insight, impact of inflation, company analysis"" report has been added to researchandmarketscom's offering global card…",2023-09-15T09:45:00Z,"dublin, sept 15, 2023 /prnewswire/ -- the ""cardiac holter monitor market, size, global forecast 2023-2030, industry trends, share, growth, insight, impact of inflation, company analysis"" report has … [+7905 chars]"
globenewswire,emergen research,global interactive kiosk market size to reach usd 5315 billion in 2032 | emergen research,strong focus of retailers to provide enhanced shopping experience for customers to increase sales and achieve quick return on investment is a major factor driving interactive kiosk market revenue growth strong focus of retailers to provide enhanced shopping e…,2023-09-22T12:00:00Z,"vancouver, sept 22, 2023 (globe newswire) -- the global interactive kiosk market size was usd 2692 billion in 2021 and is expected to register a revenue cagr of 63% during the forecast period, a… [+12193 chars]"
globenewswire,emergen research,global high-speed surgical drills & tools market size to reach usd 89889 million in 2032 | emergen research,"increasing number of surgical procedures, especially in orthopedic and neurosurgery fields is a key factor driving high-speed surgical drills & tools market revenue growth increasing number of surgical procedures, especially in orthopedic and neurosurgery fie…",2023-09-27T13:30:00Z,"vancouver, sept 27, 2023 (globe newswire) -- the global high-speed surgical drills &amp; tools market size was usd 59571 million in 2022 and is expected to register a steady revenue cagr of 42% … [+13032 chars]"
globenewswire,the insight partners,smart hospital beds market worth $149 billion by 2030 - exclusive report by the insight partners,global smart hospital beds market is growing at a cagr of 14% from 2022 to 2030 global smart hospital beds market is growing at a cagr of 14% from 2022 to 2030,2023-09-18T12:04:00Z,"pune, india, sept 18, 2023 (globe newswire) -- the electronic medical records (emr) or electronic health records (ehr) that smart beds are connected to provide a wealth of medical information, inclu… [+12242 chars]"
prnewswire,,"asia pacific artificial heart market research report 2023-2028: government initiatives, unhealthy lifestyles and cardiovascular risks propel market growth","dublin, sept 13, 2023 /prnewswire/ -- the ""asia pacific artificial heart market - industry size, share, trends, opportunity, and forecast, 2018-2028f segmented by type (ventricular assist device, total artificial heart, others), by power source (internal ba…",2023-09-13T16:30:00Z,"dublin, sept 13, 2023 /prnewswire/ -- the ""asia pacific artificial heart market - industry size, share, trends, opportunity, and forecast, 2018-2028f segmented by type (ventricular assist device, t… [+7621 chars]"
