source,author,title,description,publishedAT,content
yahoo entertainment,gurufocus research,unveiling the investment potential of intuitive surgical inc (isrg): a comprehensive analysis ,"delving into the financial growth, competitive advantages, and market leadership of intuitive surgical inc (isrg)",2023-09-18T17:03:19Z,"intuitive surgical inc (nasdaq:isrg) has recently been in the spotlight, drawing interest from investors and financial analysts due to its robust financial stance with shares currently priced at $30… [+4511 chars]"
yahoo entertainment,gurufocus research,intuitive surgical (isrg): unearthing the true value of a medical innovator,an in-depth analysis of the intrinsic value of intuitive surgical inc (isrg),2023-09-18T15:33:23Z,"intuitive surgical inc (nasdaq:isrg) has had an eventful trading period, with a daily gain of 22%, offset by a three-month loss of 809% the company's earnings per share (eps) (eps) stands at 399… [+5535 chars]"
yahoo entertainment,simply wall st,"at us$292, is intuitive surgical, inc (nasdaq:isrg) worth looking at closely?","today we're going to take a look at the well-established intuitive surgical, inc ( nasdaq:isrg ) the company's stock",2023-09-21T11:00:32Z,"today we're going to take a look at the well-established intuitive surgical, inc (nasdaq:isrg) the company's stock received a lot of attention from a substantial price movement on the nasdaqgs over… [+3868 chars]"
yahoo entertainment,fatima farooq,14 good stocks to invest in right now,"in this article, we will be taking a look at 14 good stocks to invest in right now to skip our detailed analysis of current stock market news, you can go",2023-09-13T12:59:12Z,"in this article, we will be taking a look at 14 good stocks to invest in right now to skip our detailed analysis of current stock market news, you can go directly to see the 5 good stocks to invest … [+17295 chars]"
yahoo entertainment,"lisa pham, madison muller and naomi kresge",a stock investors guide to navigating weight loss opportunities,"(bloomberg) -- for investors, there's a whole lot more to the boom in demand for weight-loss drugs than the rising stock prices of novo nordisk a/s and eli",2023-09-16T07:30:36Z,"(bloomberg) -- for investors, there's a whole lot more to the boom in demand for weight-loss drugs than the rising stock prices of novo nordisk a/s and eli lilly &amp; co most read from bloomberg … [+9151 chars]"
globenewswire,"ss innovations international, inc",ss innovations appoints colin eke to lead global business development,"mr eke brings more than 20 years industry experience to the role, including time spent at intuitive surgical and cmr surgical fort lauderdale, fl, oct",2023-10-06T13:22:00Z,"mr eke brings more than 20 years industry experience to the role, including time spent at intuitive surgical and cmr surgical fort lauderdale, fl, oct 06, 2023 (globe newswire) -- via newmediawire… [+5087 chars]"
globenewswire,neuro42,neuro42 receives direct investment and appoints surgical robotics industry pioneer fred moll as strategic advisor,"san francisco, oct 05, 2023 (globe newswire) -- neuro42, inc (“neuro42” or the “company”), a medical technology company leading the next evolution of mri and robotics, today announced it has received a direct investment from fred moll, md, industry pionee…",2023-10-05T16:00:00Z,"san francisco, oct 05, 2023 (globe newswire) -- neuro42, inc (neuro42 or the company), a medical technology company leading the next evolution of mri and robotics, today announced it has received a… [+2484 chars]"
globenewswire,allied market research,"surgical robotics market to reach $1888 billion, globally, by 2032 at 91% cagr: allied market research","the global surgical robotics market growth is attributed to various factors, including the rise in the occurrence of chronic diseases, technological advancements, and precision, and the increase in demand for minimally invasive surgical procedures the global…",2023-09-21T10:06:00Z,"new castle, delaware, sept 21, 2023 (globe newswire) -- allied market research published a report, titled,surgical robotics market by component (systems, accessories, and services), by surgery type,… [+8521 chars]"
globenewswire,"promaxo, inc",promaxo receives direct investment from surgical robotics industry pioneer fred moll and announces appointment as strategic advisor,"oakland, calif, oct 04, 2023 (globe newswire) -- promaxo, inc (“promaxo” or the “company”), a medical imaging, robotics, and ai technology company, announced today that it has received a direct investment from fred moll, md, industry pioneer and leader i…",2023-10-04T16:00:00Z,"oakland, calif, oct 04, 2023 (globe newswire) -- promaxo, inc (promaxo or the company), a medical imaging, robotics, and ai technology company, announced today that it has received a direct invest… [+2595 chars]"
globenewswire,research and markets,metaverse in healthcare market research report 2023: market is projected to grow by over $70 billion to 2028: increasing adoption of mixed reality solutions in multiple healthcare applications,"dublin, oct 10, 2023 (globe newswire) -- the ""metaverse in healthcare market by component (hardware, services, software), technology (ar/vr, mr, ai, blockchain, iot), application (telehealth, diagnostics, medical training & education), end user (provider, pa…",2023-10-10T14:03:00Z,"dublin, oct 10, 2023 (globe newswire) -- the ""metaverse in healthcare market by component (hardware, services, software), technology (ar/vr, mr, ai, blockchain, iot), application (telehealth, diagno… [+7025 chars]"
globenewswire,future market insights global and consulting pvt ltd,"intravascular imaging market sees strong demand and innovation to drive growth, reaching us$ 65629 million by 2033 | future market insights inc","comprehensive analysis of the intravascular imaging market, including market outlook, trends, and forecasts by region, product type, and detailed competitive landscape comprehensive analysis of the intravascular imaging market, including market outlook, trend…",2023-09-13T12:30:00Z,"newark, del, sept 13, 2023 (globe newswire) -- the intravascular imaging market is expected to be worth us$ 3878 million in 2023 the market is expected to be worth us$65629 million by 2033 durin… [+7557 chars]"
globenewswire,research and markets,"global soybean oil market to reach $12267 billion by 2028, fueled by health benefits and high demand in food industry","dublin, sept 12, 2023 (globe newswire) -- the ""industrial robotics market, volume, size, global forecast 2023-2030, industry trends, growth, share, outlook, impact of inflation, opportunity company analysis"" report has been added to researchandmarketscom's …",2023-09-12T12:43:00Z,"dublin, sept 12, 2023 (globe newswire) -- the ""industrial robotics market, volume, size, global forecast 2023-2030, industry trends, growth, share, outlook, impact of inflation, opportunity company … [+3897 chars]"
globenewswire,maximize market research private limited,wearable robots market expected to hit usd 92055 mn by 2029 at a cagr of 416 percent – says maximize market research,"wearable robots market is segmented into product type, technology, sales channel, and application for the analysis of the market increasing demand for rehabilitation and healthcare in the wearable robots market to boost market growth this increased demand fo…",2023-09-26T10:39:00Z,"dublin, sept 26, 2023 (globe newswire) -- a global automation &amp; process control research and business consulting firm, maximize market research, has published a market intelligence report on the… [+14076 chars]"
prnewswire,,"frost and sullivan institute honors sustainability and growth trailblazers with enlightened growth leadership awards, 2023","santa clara, calif, sept 19, 2023 /prnewswire/ -- the frost & sullivan institute is proud to present the 2023 enlightened growth leadership awards, an esteemed accolade honoring visionary companies that have embraced sustainability as the cornerstone of the…",2023-09-19T05:13:00Z,"santa clara, calif, sept 19, 2023 /prnewswire/ -- the frost &amp; sullivan institute is proud to present the 2023 enlightened growth leadership awards, an esteemed accolade honoring visionary compa… [+4172 chars]"
globenewswire,emergen research,global infotainment system on chip (soc) market size to reach usd 1881 billion in 2032 | emergen research,rising concerns regarding road workers and traffic safety management is a major factor driving infotainment system on chip (soc) market revenue growth rising concerns regarding road workers and traffic safety management is a major factor driving infotainment …,2023-09-25T10:41:00Z,"vancouver, sept 25, 2023 (globe newswire) -- the global infotainment system on chip (soc) market size is expected to reach usd 1881 billion in 2032 and register a steady revenue cagr of 97% over… [+12709 chars]"
prnewswire,,"laparoscopic devices market to grow by usd 439 billion from 2022-2027, north america to account for 36% of market growth - technavio","new york, sept 24, 2023 /prnewswire/ -- the laparoscopic devices market size is expected to grow by usd 439 billion from 2022 to 2027 in addition, the momentum of the market will progress at a cagr of 811% during the forecast period, according to technavi…",2023-09-24T10:35:00Z,"new york, sept 24, 2023 /prnewswire/ -- the laparoscopic devices market size is expected to grow by usd 439 billion from 2022 to 2027 in addition, the momentum of the market will progress at a cag… [+5531 chars]"
prnewswire,,galvanize therapeutics begins us clinical study using aliya™ pulsed electric field (pef) for stage iv non-small cell lung cancer or metastasis to the lung,"first patient treated in the us with aliya pef delivered via an endobronchial approach with robotic-assisted navigation redwood city, calif , sept 20, 2023 /prnewswire/ -- galvanize therapeutics, inc today announced the treatment of the first patient in …",2023-09-20T11:00:00Z,"first patient treated in the us with aliya pef delivered via an endobronchial approach with robotic-assisted navigation redwood city, calif , sept 20, 2023 /prnewswire/ -- galvanize therapeutics… [+4220 chars]"
prnewswire,,fluidai medical teams up with medtronic for remote monitoring via digital's continuous connected patient care project,"kitchener, on, sept 14, 2023 /prnewswire/ - fluidai medical, a leading artificial intelligence (ai) startup and developer of the stream™ platform for post-surgical monitoring, has announced a strategic partnership with medtronic canada ulc, a prominent subsi…",2023-09-14T11:30:00Z,"kitchener, on, sept 14, 2023 /prnewswire/ - fluidai medical, a leading artificial intelligence (ai) startup and developer of the stream platform for post-surgical monitoring, has announced a strateg… [+9171 chars]"
financial post,bloomberg news,a stock investors guide to navigating weight-loss opportunities,here are some of the stocks and sectors that are likely to see the biggest impact from the boom in demand for weight-loss drugs read on,2023-09-20T15:12:56Z,here are some of the stocks and sectors that are likely to see the biggest impact author of the article: the anti-diabetic medication ozempic made by danish pharmaceutical company novo nordisk a/s… [+12810 chars]
marketwatch,NA,"company close updates: stryker corp stock falls tuesday, underperforms market","shares of stryker corp slid 481% to $27355 tuesday, on what proved to be an all-around dismal trading session for the stock market, with the s&p 500 index",2023-09-26T20:41:54Z,"shares of stryker corp syk, -481% slid 481% to $27355 tuesday, on what proved to be an all-around dismal trading session for the stock market, with the s&amp;p 500 index spx, -147% f… [+776 chars]"
marketwatch,NA,company close updates: stryker corp stock outperforms market on strong trading day,"shares of stryker corp inched 087% higher to $29732 wednesday, on what proved to be an all-around mixed trading session for the stock market, with the s&p",2023-09-13T20:41:19Z,"shares of stryker corp syk, +087% inched 087% higher to $29732 wednesday, on what proved to be an all-around mixed trading session for the stock market, with the s&amp;p 500 index spx, … [+722 chars]"
marketwatch,james rogers,"the ratings game: these 20 growth stocks are worth considering on a pullback, says citi","the russell 1000 growth index is down modestly from recent highs, but citi says there is “more carnage under the surface”",2023-09-25T18:38:02Z,"citi has released a list of 20 large-cap growth stocks that it says present opportunities in the event of a pullbackour call since early summer has been to hold growth and look to buy on pullbacks, … [+2664 chars]"
marketwatch,philip van doorn,deep dive: this fund shows that industry expertise can help you make a lot of money in the stock market,the managers of the janus henderson global life sciences fund have direct experience to help them separate promising innovators from flashes in the pan,2023-10-02T16:37:29Z,investors and the financial media have been fixated on exchange-traded funds for decades the inexpensive passive tracking of stock indexes often has led to a performance that traditional active mone… [+8630 chars]
thefreedictionarycom,,risk,"risk refers to the potential negative impact that may arise from some present or future event in common usage, it has become synonymous with the probability of a loss or threat there are different definitions of risk, and its measurement can be difficult, b…",2023-10-12T04:05:58Z,"risk is the potential of gaining or losing something of value[1] values (such as physical health, social status, emotional well-being, or financial wealth) can be gained or lost when taking risk res… [+58580 chars]"
plosorg,"maximilian kaluschke, myat su yin, peter haddawy, siriwan suebnukarn, gabriel zachmann",the effect of 3d stereopsis and hand-tool alignment on learning effectiveness and skill transfer of a vr-based simulator for dental training,recent years have seen the proliferation of vr-based dental simulators using a wide variety of different vr configurations with varying degrees of realism important aspects distinguishing vr hardware configurations are 3d stereoscopic rendering and visual al…,2023-10-04T14:00:00Z,abstract recent years have seen the proliferation of vr-based dental simulators using a wide variety of different vr configurations with varying degrees of realism important aspects distinguishing … [+77568 chars]
