source,author,title,description,publishedAT,content
yahoo entertainment,gurufocus research,decoding tandem diabetes care inc (tndm)'s performance potential: a deep dive into key metrics,unraveling the factors that could limit tandem diabetes care inc's future growth,2023-09-26T17:04:56Z,"long-established in the medical devices &amp; instruments industry, tandem diabetes care inc (nasdaq:tndm) has enjoyed a stellar reputation it has recently witnessed a daily gain of 497%, juxtapose… [+3519 chars]"
yahoo entertainment,gurufocus research,is tandem diabetes care (tndm) too good to be true? a comprehensive analysis of a potential ,deciphering the risks and rewards of investing in tandem diabetes care,2023-09-14T23:37:24Z,"value-focused investors are always on the hunt for stocks that are priced below their intrinsic value one such stock that merits attention is tandem diabetes care inc (nasdaq:tndm) the stock, which… [+4812 chars]"
yahoo entertainment,gurufocus research,unraveling the future of tandem diabetes care inc (tndm): a deep dive into key metrics,understanding the factors limiting growth and performance,2023-09-15T16:05:47Z,"long-established in the medical devices &amp; instruments industry, tandem diabetes care inc (nasdaq:tndm) has enjoyed a stellar reputation however, it has recently witnessed a decline of 615%, jux… [+3137 chars]"
yahoo entertainment,"lisa pham, madison muller and naomi kresge",a stock investors guide to navigating weight loss opportunities,"(bloomberg) -- for investors, there's a whole lot more to the boom in demand for weight-loss drugs than the rising stock prices of novo nordisk a/s and eli",2023-09-16T07:30:36Z,"(bloomberg) -- for investors, there's a whole lot more to the boom in demand for weight-loss drugs than the rising stock prices of novo nordisk a/s and eli lilly &amp; co most read from bloomberg … [+9151 chars]"
marketscreenercom,prnewswire,"tndm investors have opportunity to lead tandem diabetes care, inc securities fraud lawsuit","(marketscreenercom) los angeles, oct 6, 2023 /prnewswire/ -- glancy prongay & murray llp announces that investors with substantial losses have opportunity to lead the securities fraud class action lawsuit against tandem diabetes care, inc …",2023-10-06T16:01:06Z,"los angeles, oct 6, 2023 /prnewswire/ -- glancy prongay &amp; murray llp (""gpm"") announces that investors with substantial losses have opportunity to lead the securities fraud class action lawsuit a… [+2451 chars]"
marketscreenercom,business wire,"tndm investor deadline: robbins geller rudman & dowd llp announces that tandem diabetes care, inc investors with substantial losses have opportunity to lead class action lawsuit","(marketscreenercom) robbins geller rudman & dowd llp announces that purchasers or acquirers of tandem diabetes care, inc securities between august 3, 2022 and november 2, 2022, both dates inclusive have until november 7, 2023 to seek appointment as lead pl…",2023-09-18T15:46:02Z,"robbins geller rudman &amp; dowd llp announces that purchasers or acquirers of tandem diabetes care, inc (nasdaq: tndm) securities between august 3, 2022 and november 2, 2022, both dates inclusive (… [+4055 chars]"
globenewswire,robbins llp,"tandem diabetes care, inc (tndm) investor alert: robbins llp reminds investors of class action filed against tandem diabetes care, inc","san diego, sept 15, 2023 (globe newswire) -- robbins llp reminds investors that a shareholder filed a class action on behalf of all investors who purchased or otherwise acquired tandem diabetes care, inc (nasdaq: tndm) securities between august 3, 2022 and …",2023-09-15T17:52:00Z,"san diego, sept 15, 2023 (globe newswire) -- robbins llp reminds investors that a shareholder filed a class action on behalf of all investors who purchased or otherwise acquired tandem diabetes care… [+2926 chars]"
marketscreenercom,business wire,"tandem diabetes care, inc (tndm) class action notice: robbins llp reminds investors of lead plaintiff deadline in tandem diabetes care, inc securities fraud class action","(marketscreenercom) robbins llp reminds investors that a shareholder filed a class action on behalf of all investors who purchased or otherwise acquired tandem diabetes care, inc securities between august 3, 2022 and november 2, 2022 tandem is a global me…",2023-09-18T19:41:02Z,"robbins llp reminds investors that a shareholder filed a class action on behalf of all investors who purchased or otherwise acquired tandem diabetes care, inc (nasdaq: tndm) securities between augus… [+2971 chars]"
globenewswire,robbins llp,"tndm shareholders who have lost money in the stock should contact robbins llp for information about the class action against tandem diabetes care, inc","tandem diabetes care, inc (tndm) misled investors regarding revenue projections ",2023-09-28T15:05:00Z,"san diego, sept 28, 2023 (globe newswire) -- robbins llp reminds investors that a shareholder filed a class action on behalf of all investors who purchased or otherwise acquired tandem diabetes care… [+2926 chars]"
globenewswire,robbins llp,"tandem diabetes care, inc investors: lead plaintiff deadline is approaching in the class action against tandem diabetes care, inc; contact robbins llp today","tandem diabetes care, inc (tndm) misled investors regarding revenue projections ",2023-10-05T18:59:00Z,"san diego, oct 05, 2023 (globe newswire) -- robbins llp reminds investors that a shareholder filed a class action on behalf of all investors who purchased or otherwise acquired tandem diabetes care,… [+2925 chars]"
marketscreenercom,prnewswire,"tndm investors have opportunity to lead tandem diabetes care, inc securities fraud lawsuit","(marketscreenercom) los angeles, sept 27, 2023 /prnewswire/ -- the law offices of frank r cruz announces that investors with substantial losses have opportunity to lead the securities fraud class action lawsuit against tandem diabetes care, inc class…",2023-09-27T20:14:03Z,"los angeles, sept 27, 2023 /prnewswire/ -- the law offices of frank r cruz announces that investors with substantial losses have opportunity to lead the securities fraud class action lawsuit agains… [+2177 chars]"
marketscreenercom,prnewswire,"rosen, a longstanding law firm, encourages tandem diabetes care, inc investors with losses in excess of $100k to secure counsel before important deadline in securities class action - tndm","(marketscreenercom) new york, sept 28, 2023 /prnewswire/ -- why: rosen law firm, a global investor rights law firm, reminds purchasers of securities of tandem diabetes care, inc between august 3, 2022 and november 2, 2022, both datesh…",2023-09-28T20:04:03Z,"new york, sept 28, 2023 /prnewswire/ -- why: rosen law firm, a global investor rights law firm, reminds purchasers of securities of tandem diabetes care, inc (nasdaq: tndm) between august 3, 2022… [+5058 chars]"
marketscreenercom,prnewswire,"pomerantz law firm investigates claims on behalf of investors of tandem diabetes care, inc - tndm","(marketscreenercom) new york, sept 29, 2023 /prnewswire/ -- pomerantz llp is investigating claims on behalf of investors of tandem diabetes care, inc such investors are advised to contact robert s willoughby at newaction@pomlawcom or 888-476-6529, e…",2023-09-29T21:04:03Z,"new york, sept 29, 2023 /prnewswire/ -- pomerantz llp is investigating claims on behalf of investors of tandem diabetes care, inc (""tandem"" or the ""company"") (nasdaq: tndm) such investors are advi… [+2001 chars]"
marketscreenercom,,"tndm investors have opportunity to lead tandem diabetes care, inc securities fraud lawsuit","(marketscreenercom) los angeles, oct 11, 2023 /prnewswire/ -- the law offices of frank r cruz announces that investors with substantial losses have opportunity to lead the securities fraud class action lawsuit against tandem diabetes care, inc class …",2023-10-11T16:01:05Z,"los angeles, oct 11, 2023 /prnewswire/ -- the law offices of frank r cruz announces that investors with substantial losses have opportunity to lead the securities fraud class action lawsuit against… [+2174 chars]"
marketscreenercom,prnewswire,"pomerantz law firm investigates claims on behalf of investors of tandem diabetes care, inc - tndm","(marketscreenercom) new york, sept 13, 2023 /prnewswire/ -- pomerantz llp is investigating claims on behalf of investors of tandem diabetes care, inc such investors are advised to contact robert s willoughby at newaction@pomlawcom or 888-476-652…",2023-09-13T21:04:04Z,"new york, sept 13, 2023 /prnewswire/ -- pomerantz llp is investigating claims on behalf of investors of tandem diabetes care, inc (""tandem"" or the ""company"") (nasdaq: tndm) such investors are a… [+2005 chars]"
marketscreenercom,prnewswire,"pomerantz law firm investigates claims on behalf of investors of tandem diabetes care, inc - tndm","(marketscreenercom) new york, sept 21, 2023 /prnewswire/ -- pomerantz llp is investigating claims on behalf of investors of tandem diabetes care, inc such investors are advised to contact robert s willoughby at newaction@pomlawcom or 888-476-6529, ex…",2023-09-21T21:39:03Z,"new york, sept 21, 2023 /prnewswire/ -- pomerantz llp is investigating claims on behalf of investors of tandem diabetes care, inc (""tandem"" or the ""company"") (nasdaq: tndm) such investors are advi… [+1998 chars]"
marketscreenercom,prnewswire,"tndm investors have opportunity to lead tandem diabetes care, inc securities fraud lawsuit","(marketscreenercom) bensalem, pa, oct 3, 2023 /prnewswire/ -- law offices of howard g smith announces that investors with substantial losses have opportunity to lead the securities fraud class action lawsuit against tandem diabetes care, inc class p…",2023-10-03T13:01:20Z,"bensalem, pa, oct 3, 2023 /prnewswire/ -- law offices of howard g smith announces that investors with substantial losses have opportunity to lead the securities fraud class action lawsuit against … [+2348 chars]"
marketscreenercom,,"pomerantz law firm investigates claims on behalf of investors of tandem diabetes care, inc - tndm","(marketscreenercom) new york, oct 9, 2023 /prnewswire/ -- pomerantz llp is investigating claims on behalf of investors of tandem diabetes care, inc such investors are advised to contact robert s willoughby at newaction@pomlawcom or 888-476-6529, ext…",2023-10-09T19:37:03Z,"new york, oct 9, 2023 /prnewswire/ -- pomerantz llp is investigating claims on behalf of investors of tandem diabetes care, inc (""tandem"" or the ""company"") (nasdaq: tndm) such investors are advise… [+1996 chars]"
globenewswire,robbins geller rudman & dowd llp,"tndm investor notice: robbins geller rudman & dowd llp announces that tandem diabetes care, inc investors with substantial losses have opportunity to lead class action lawsuit","san diego, sept 12, 2023 (globe newswire) -- the law firm of robbins geller rudman & dowd llp announces that purchasers or acquirers of tandem diabetes care, inc (nasdaq: tndm) securities between august 3, 2022 and november 2, 2022, inclusive (the “class pe…",2023-09-12T16:38:00Z,"san diego, sept 12, 2023 (globe newswire) -- the law firm of robbins geller rudman &amp; dowd llp announces that purchasers or acquirers of tandem diabetes care, inc (nasdaq: tndm) securities betwe… [+4142 chars]"
marketscreenercom,business wire,"law offices of howard g smith announces investigation of tandem diabetes care, inc (tndm) on behalf of investors","(marketscreenercom) law offices of howard g smith announces an investigation on behalf of tandem diabetes care, inc investors concerning the companys possible violations of federal securities laws on november 2, 2022, tandem revised its 2022 financial…",2023-09-14T20:46:01Z,"law offices of howard g smith announces an investigation on behalf of tandem diabetes care, inc (tandem or the company) (nasdaq: tndm) investors concerning the companys possible violations of feder… [+1170 chars]"
marketscreenercom,newsfilecorp,"rosen, global investor counsel, encourages tandem diabetes care, inc investors to secure counsel before important deadline in securities class action - tndm","(marketscreenercom) why: rosen law firm, a global investor rights law firm, reminds purchasers of securities of tandem diabetes care, inc between august 3, 2022 and november 2, 2022, both dates inclusive , of the important november 7, 2023 lead plaintiff de…",2023-10-03T19:45:01Z,"new york, new york--(newsfile corp - october 3, 2023) - why: rosen law firm, a global investor rights law firm, reminds purchasers of securities of tandem diabetes care, inc (nasdaq: tndm) between … [+4890 chars]"
marketscreenercom,business wire,"the law offices of frank r cruz announces investigation of tandem diabetes care, inc (tndm) on behalf of investors","(marketscreenercom) the law offices of frank r cruz announces an investigation of tandem diabetes care, inc on behalf of investors concerning the companys possible violations of federal securities laws if you are a shareholder who suffered a loss, cli…",2023-09-13T18:39:02Z,"the law offices of frank r cruz announces an investigation of tandem diabetes care, inc (tandem or the company) (nasdaq: tndm) on behalf of investors concerning the companys possible violations of … [+1358 chars]"
marketscreenercom,business wire,"glancy prongay & murray llp, a leading securities fraud law firm, announces investigation of tandem diabetes care, inc (tndm) on behalf of investors","(marketscreenercom) glancy prongay & murray llp , a leading national shareholder rights law firm, today announced that it has commenced an investigation on behalf of tandem diabetes care, inc investors concerning the companys possible violations of the fe…",2023-09-15T15:01:02Z,"glancy prongay &amp; murray llp (gpm), a leading national shareholder rights law firm, today announced that it has commenced an investigation on behalf of tandem diabetes care, inc (tandem or the co… [+3317 chars]"
marketscreenercom,,"tandem diabetes care to announce third quarter 2023 financial results on november 1, 2023","(marketscreenercom) tandem diabetes care, inc , a leading insulin delivery and diabetes technology company, plans to release its third quarter 2023 results after the financial markets close on wednesday, november 1, 2023 the company will hold a conference…",2023-10-10T20:06:03Z,"tandem diabetes care, inc (nasdaq: tndm), a leading insulin delivery and diabetes technology company, plans to release its third quarter 2023 results after the financial markets close on wednesday, … [+1900 chars]"
globenewswire,bernstein liebhard llp,"tandem diabetes care, inc (nasdaq: tndm) deadline alert: bernstein liebhard llp announces that a securities class action lawsuit has been filed against tandem diabetes care, inc","new york, sept 25, 2023 (globe newswire) -- bernstein liebhard llp: do you, or did you, own shares of tandem diabetes care, inc (nasdaq: tndm)?did",2023-09-25T16:30:00Z,"new york, sept 25, 2023 (globe newswire) -- bernstein liebhard llp: <ul><li>do you, or did you, own shares of tandem diabetes care, inc (nasdaq: tndm)?</li><li>did you purchase your shares between… [+3765 chars]"
globenewswire,"johnson fistel, llp",johnson fistel announces a class action lawsuit has been filed against tandem diabetes care,"san diego, sept 25, 2023 (globe newswire) -- johnson fistel, llp notifies investors of tandem diabetes care, inc (nasdaq: tndm) (“tandem diabetes care” or the “company”) a securities class action lawsuit has been filed the lawsuit seeks to recover losses o…",2023-09-25T14:35:00Z,"san diego, sept 25, 2023 (globe newswire) -- johnson fistel, llp notifies investors of tandem diabetes care, inc (nasdaq: tndm) (tandem diabetes care or the company) a securities class action lawsu… [+2970 chars]"
globenewswire,"johnson fistel, llp",tndm shareholder update: johnson fistel encourages tandem diabetes care investors to seek counsel before lead plaintiff class action deadline,"san diego, oct 06, 2023 (globe newswire) -- johnson fistel, llp notifies investors of tandem diabetes care, inc (nasdaq: tndm) (“tandem diabetes care” or the “company”) a securities class action lawsuit has been filed the lawsuit seeks to recover losses on…",2023-10-06T14:02:00Z,"san diego, oct 06, 2023 (globe newswire) -- johnson fistel, llp notifies investors of tandem diabetes care, inc (nasdaq: tndm) (tandem diabetes care or the company) a securities class action lawsui… [+2969 chars]"
marketscreenercom,business wire,"law offices of howard g smith announces the filing of a securities class action on behalf of tandem diabetes care, inc (tndm) investors","(marketscreenercom) law offices of howard g smith announces that a class action lawsuit has been filed on behalf of investors who purchased tandem diabetes care, inc securities between august 3, 20222 and november 2, 2022, inclusive tandem investors hav…",2023-09-18T13:31:01Z,"law offices of howard g smith announces that a class action lawsuit has been filed on behalf of investors who purchased tandem diabetes care, inc (tandem or the company) (nasdaq: tndm) securities b… [+2562 chars]"
globenewswire,bernstein liebhard llp,"deadline alert: bernstein liebhard llp reminds tandem diabetes care, inc investors of upcoming deadline","new york, oct 03, 2023 (globe newswire) -- bernstein liebhard llp: do you, or did you, own shares of tandem diabetes care, inc (nasdaq: tndm)?did",2023-10-03T05:45:00Z,"new york, oct 03, 2023 (globe newswire) -- bernstein liebhard llp: <ul><li>do you, or did you, own shares of tandem diabetes care, inc (nasdaq: tndm)?</li><li>did you purchase your shares between … [+2290 chars]"
globenewswire,robbins llp,"tndm shareholder alert: investors with large losses should contact robbins llp for information about recovery against tandem diabetes care, inc","san diego, sept 21, 2023 (globe newswire) -- robbins llp reminds investors that a shareholder filed a class action on behalf of all investors who purchased or otherwise acquired tandem diabetes care, inc (nasdaq: tndm) securities between august 3, 2022 and …",2023-09-21T22:52:00Z,"san diego, sept 21, 2023 (globe newswire) -- robbins llp reminds investors that a shareholder filed a class action on behalf of all investors who purchased or otherwise acquired tandem diabetes care… [+2921 chars]"
marketscreenercom,business wire,"the law offices of frank r cruz announces the filing of a securities class action on behalf of tandem diabetes care, inc (tndm) investors","(marketscreenercom) the law offices of frank r cruz announces that a class action lawsuit has been filed on behalf of persons and entities that purchased or otherwise acquired tandem diabetes care, inc securities between august 3, 2022 and november 2, 202…",2023-09-18T17:06:01Z,"the law offices of frank r cruz announces that a class action lawsuit has been filed on behalf of persons and entities that purchased or otherwise acquired tandem diabetes care, inc (tandem or the … [+2881 chars]"
marketscreenercom,business wire,"glancy prongay & murray llp reminds investors of looming deadline in the class action lawsuit against tandem diabetes care, inc (tndm)","(marketscreenercom) glancy prongay & murray llp reminds investors of the upcoming november 7, 2023 deadline to file a lead plaintiff motion in the class action filed on behalf of investors who purchased or otherwise acquired tandem diabetes care, inc secur…",2023-09-22T16:50:02Z,"glancy prongay &amp; murray llp (gpm) reminds investors of the upcoming november 7, 2023 deadline to file a lead plaintiff motion in the class action filed on behalf of investors who purchased or oth… [+3268 chars]"
marketscreenercom,business wire,"deadline reminder: law offices of howard g smith reminds investors of looming deadline in the class action lawsuit against tandem diabetes care, inc (tndm)","(marketscreenercom) law offices of howard g smith reminds investors of the upcoming november 7, 2023 deadline to file a lead plaintiff motion in the case filed on behalf of investors who purchased tandem diabetes care, inc securities between august 3, 202…",2023-09-21T13:10:01Z,"law offices of howard g smith reminds investors of the upcoming november 7, 2023 deadline to file a lead plaintiff motion in the case filed on behalf of investors who purchased tandem diabetes care,… [+2907 chars]"
marketscreenercom,business wire,"glancy prongay & murray llp, a leading securities fraud law firm, announces the filing of a securities class action on behalf of tandem diabetes care, inc (tndm) investors","(marketscreenercom) glancy prongay & murray llp , a leading national shareholder rights law firm, announces that a class action lawsuit has been filed on behalf of investors who purchased or otherwise acquired tandem diabetes care, inc securities between a…",2023-09-19T17:13:01Z,"glancy prongay &amp; murray llp (gpm), a leading national shareholder rights law firm, announces that a class action lawsuit has been filed on behalf of investors who purchased or otherwise acquired … [+3260 chars]"
globenewswire,glancy prongay & murray llp,"glancy prongay & murray llp reminds investors of looming deadline in the class action lawsuit against tandem diabetes care, inc (tndm)","los angeles, sept 25, 2023 (globe newswire) -- glancy prongay & murray llp (“gpm”) reminds investors of the upcoming november 7, 2023 deadline to file a lead plaintiff motion in the class action filed on behalf of investors who purchased or otherwise acquire…",2023-09-25T15:00:00Z,"los angeles, sept 25, 2023 (globe newswire) -- glancy prongay &amp; murray llp (gpm) reminds investors of the upcoming november 7, 2023 deadline to file a lead plaintiff motion in the class action f… [+3360 chars]"
globenewswire,glancy prongay & murray llp,"glancy prongay & murray llp reminds investors of looming deadline in the class action lawsuit against tandem diabetes care, inc (tndm)","los angeles, oct 02, 2023 (globe newswire) -- glancy prongay & murray llp (“gpm”) reminds investors of the upcoming november 7, 2023 deadline to file a lead plaintiff motion in the class action filed on behalf of investors who purchased or otherwise acquired…",2023-10-02T17:02:00Z,"los angeles, oct 02, 2023 (globe newswire) -- glancy prongay &amp; murray llp (gpm) reminds investors of the upcoming november 7, 2023 deadline to file a lead plaintiff motion in the class action fi… [+3359 chars]"
globenewswire,pomerantz llp,"shareholder alert: pomerantz law firm investigates claims on behalf of investors of tandem diabetes care, inc - tndm","new york, oct 11, 2023 (globe newswire) -- pomerantz llp is investigating claims on behalf of investors of tandem diabetes care, inc (“tandem” or the “company”) (nasdaq: tndm) such investors are advised to contact robert s willoughby at newaction@pomlaw…",2023-10-11T15:47:00Z,"new york, oct 11, 2023 (globe newswire) -- pomerantz llp is investigating claims on behalf of investors of tandem diabetes care, inc (tandem or the company) (nasdaq: tndm) such investors are advis… [+1767 chars]"
globenewswire,glancy prongay & murray llp,"glancy prongay & murray llp reminds investors of looming deadline in the class action lawsuit against tandem diabetes care, inc (tndm)","los angeles, oct 09, 2023 (globe newswire) -- glancy prongay & murray llp (“gpm”) reminds investors of the upcoming november 7, 2023 deadline to file a lead plaintiff motion in the class action filed on behalf of investors who purchased or otherwise acquired…",2023-10-09T16:00:00Z,"los angeles, oct 09, 2023 (globe newswire) -- glancy prongay &amp; murray llp (gpm) reminds investors of the upcoming november 7, 2023 deadline to file a lead plaintiff motion in the class action fi… [+3359 chars]"
globenewswire,pomerantz llp,"shareholder alert: pomerantz law firm investigates claims on behalf of investors of tandem diabetes care, inc - tndm","new york, sept 25, 2023 (globe newswire) -- pomerantz llp is investigating claims on behalf of investors of tandem diabetes care, inc (“tandem” or the “company”) (nasdaq: tndm) such investors are advised to contact robert s willoughby at newaction@poml…",2023-09-25T22:47:00Z,"new york, sept 25, 2023 (globe newswire) -- pomerantz llp is investigating claims on behalf of investors of tandem diabetes care, inc (tandem or the company) (nasdaq: tndm) such investors are ad… [+1768 chars]"
globenewswire,pomerantz llp,"shareholder alert: pomerantz law firm investigates claims on behalf of investors of tandem diabetes care, inc - tndm","new york, oct 03, 2023 (globe newswire) -- pomerantz llp is investigating claims on behalf of investors of tandem diabetes care, inc (“tandem” or the “company”) (nasdaq: tndm) such investors are advised to contact robert s willoughby at newaction@pomlaw…",2023-10-03T16:45:00Z,"new york, oct 03, 2023 (globe newswire) -- pomerantz llp is investigating claims on behalf of investors of tandem diabetes care, inc (tandem or the company) (nasdaq: tndm) such investors are advi… [+1766 chars]"
globenewswire,gainey mckenna & egleston,"gainey mckenna & egleston announces a class action lawsuit has been filed against tandem diabetes care, inc (tndm)","new york, sept 12, 2023 (globe newswire) -- gainey mckenna & egleston announces that a securities class action lawsuit has been filed in the united states district court for the southern district of california on behalf of all persons or entities who purchas…",2023-09-12T21:58:00Z,"new york, sept 12, 2023 (globe newswire) -- gainey mckenna &amp; egleston announces that a securities class action lawsuit has been filed in the united states district court for the southern distric… [+2082 chars]"
