source,author,title,description,publishedAT,content
globenewswire,bragar eagel & squire,"bragar eagel & squire, pc reminds investors that class action lawsuits have been filed against uipath, tandem, and leslies and encourages investors to contact the firm","new york, sept 17, 2023 (globe newswire) -- bragar eagel & squire, pc, a nationally recognized shareholder rights law firm, reminds investors that class actions have been commenced on behalf of stockholders of uipath, inc (nyse: path), tandem diabetes car…",2023-09-18T01:00:00Z,"new york, sept 17, 2023 (globe newswire) -- bragar eagel &amp; squire, pc, a nationally recognized shareholder rights law firm, reminds investors that class actions have been commenced on behalf o… [+5311 chars]"
globenewswire,bragar eagel & squire,"bragar eagel & squire, pc reminds investors that class action lawsuits have been filed against uipath, tandem, and leslies and encourages investors to contact the firm","new york, sept 22, 2023 (globe newswire) -- bragar eagel & squire, pc, a nationally recognized shareholder rights law firm, reminds investors that class actions have been commenced on behalf of stockholders of uipath, inc (nyse: path), tandem diabetes car…",2023-09-23T01:00:00Z,"new york, sept 22, 2023 (globe newswire) -- bragar eagel &amp; squire, pc, a nationally recognized shareholder rights law firm, reminds investors that class actions have been commenced on behalf o… [+5311 chars]"
globenewswire,bragar eagel & squire,"bragar eagel & squire, pc reminds investors that class action lawsuits have been filed against uipath, tandem, and leslies and encourages investors to contact the firm","new york, oct 08, 2023 (globe newswire) -- bragar eagel & squire, pc, a nationally recognized shareholder rights law firm, reminds investors that class actions have been commenced on behalf of stockholders of uipath, inc (nyse: path), tandem diabetes care…",2023-10-09T01:00:00Z,"new york, oct 08, 2023 (globe newswire) -- bragar eagel &amp; squire, pc, a nationally recognized shareholder rights law firm, reminds investors that class actions have been commenced on behalf of… [+5310 chars]"
globenewswire,"lifshitz law firm, pc","lifshitz law pllc announces investigations of uipath, inc (nyse: path), tandem diabetes care, inc (nasdaq: tndm), leslies, inc (nasdaq: lesl), and pacwest bancorp (nasdaq: pacw)","new york, sept 30, 2023 (globe newswire) -- uipath, inc (nyse: path) lifshitz law pllc announces investigation into possible securities laws",2023-09-30T23:00:00Z,"new york, sept 30, 2023 (globe newswire) -- uipath, inc (nyse: path) lifshitz law pllc announces investigation into possible securities laws violations and/or breaches of fiduciary duties in con… [+4992 chars]"
globenewswire,"lifshitz law firm, pc","lifshitz law pllc announces investigations of uipath, inc (nyse: path), tandem diabetes care, inc (nasdaq: tndm), leslies, inc (nasdaq: lesl), and pacwest bancorp (nasdaq: pacw)","new york, sept 23, 2023 (globe newswire) -- uipath, inc (nyse: path) lifshitz law pllc announces investigation into possible securities laws",2023-09-23T23:09:00Z,"new york, sept 23, 2023 (globe newswire) -- uipath, inc (nyse: path) lifshitz law pllc announces investigation into possible securities laws violations and/or breaches of fiduciary duties in con… [+5013 chars]"
globenewswire,the rosen law firm pa,"rosen, recognized investor counsel, encourages tandem diabetes care, inc investors to secure counsel before important deadline in securities class action – tndm","new york, oct 05, 2023 (globe newswire) -- why: rosen law firm, a global investor rights law firm, reminds purchasers of securities of tandem diabetes care, inc (nasdaq: tndm) between august 3, 2022 and november 2, 2022, both dates inclusive (the “class per…",2023-10-05T23:12:00Z,"new york, oct 05, 2023 (globe newswire) -- why: rosen law firm, a global investor rights law firm, reminds purchasers of securities of tandem diabetes care, inc (nasdaq: tndm) between august 3, 2… [+4760 chars]"
globenewswire,the rosen law firm pa,"rosen, top ranked global counsel, encourages tandem diabetes care, inc investors with losses in excess of $100k to secure counsel before important deadline in securities class action – tndm","new york, sept 29, 2023 (globe newswire) -- why: rosen law firm, a global investor rights law firm, reminds purchasers of securities of tandem diabetes care, inc (nasdaq: tndm) between august 3, 2022 and november 2, 2022, both dates inclusive (the “class pe…",2023-09-30T00:33:00Z,"new york, sept 29, 2023 (globe newswire) -- why: rosen law firm, a global investor rights law firm, reminds purchasers of securities of tandem diabetes care, inc (nasdaq: tndm) between august 3, 20… [+4717 chars]"
globenewswire,the rosen law firm pa,"rosen, skilled investor counsel, encourages tandem diabetes care, inc investors to secure counsel before important deadline in securities class action – tndm","new york, sept 23, 2023 (globe newswire) -- why: rosen law firm, a global investor rights law firm, reminds purchasers of securities of tandem diabetes care, inc (nasdaq: tndm) between august 3, 2022 and november 2, 2022, both dates inclusive (the “class pe…",2023-09-23T12:42:00Z,"new york, sept 23, 2023 (globe newswire) -- why: rosen law firm, a global investor rights law firm, reminds purchasers of securities of tandem diabetes care, inc (nasdaq: tndm) between august 3, … [+4720 chars]"
globenewswire,the rosen law firm pa,"rosen, a longstanding law firm, encourages tandem diabetes care, inc investors with losses to secure counsel before important deadline in securities class action – tndm","new york, oct 10, 2023 (globe newswire) -- why: rosen law firm, a global investor rights law firm, reminds purchasers of securities of tandem diabetes care, inc (nasdaq: tndm) between august 3, 2022 and november 2, 2022, both dates inclusive (the “class per…",2023-10-10T19:25:00Z,"new york, oct 10, 2023 (globe newswire) -- why: rosen law firm, a global investor rights law firm, reminds purchasers of securities of tandem diabetes care, inc (nasdaq: tndm) between august 3, 2… [+4759 chars]"
globenewswire,bragar eagel & squire,"bragar eagel & squire, pc reminds investors that class action lawsuits have been filed against tandem, leslies, and pacwest and encourages investors to contact the firm","new york, oct 03, 2023 (globe newswire) -- bragar eagel & squire, pc, a nationally recognized shareholder rights law firm, reminds investors that class actions have been commenced on behalf of stockholders of tandem diabetes care, inc (nasdaq: tndm), lesl…",2023-10-04T01:00:00Z,"new york, oct 03, 2023 (globe newswire) -- bragar eagel &amp; squire, pc, a nationally recognized shareholder rights law firm, reminds investors that class actions have been commenced on behalf of… [+5107 chars]"
globenewswire,bragar eagel & squire,"bragar eagel & squire, pc reminds investors that class action lawsuits have been filed against tandem, leslies, and pacwest and encourages investors to contact the firm","new york, sept 28, 2023 (globe newswire) -- bragar eagel & squire, pc, a nationally recognized shareholder rights law firm, reminds investors that class actions have been commenced on behalf of stockholders of tandem diabetes care, inc (nasdaq: tndm), les…",2023-09-29T01:00:00Z,"new york, sept 28, 2023 (globe newswire) -- bragar eagel &amp; squire, pc, a nationally recognized shareholder rights law firm, reminds investors that class actions have been commenced on behalf o… [+5108 chars]"
globenewswire,the rosen law firm pa,"rosen, global investor counsel, encourages tandem diabetes care, inc investors to secure counsel before important deadline in securities class action – tndm","new york, sept 15, 2023 (globe newswire) -- why: rosen law firm, a global investor rights law firm, announces the filing of a class action lawsuit on behalf of purchasers of securities of tandem diabetes care, inc (nasdaq: tndm) between august 3, 2022 and n…",2023-09-15T22:26:00Z,"new york, sept 15, 2023 (globe newswire) -- why: rosen law firm, a global investor rights law firm, announces the filing of a class action lawsuit on behalf of purchasers of securities of tandem dia… [+4711 chars]"
prnewswire,,"tndm investors have opportunity to lead tandem diabetes care, inc securities fraud lawsuit","los angeles, sept 27, 2023 /prnewswire/ -- the law offices of frank r cruz announces that investors with substantial losses have opportunity to lead the securities fraud class action lawsuit against tandem diabetes care, inc (""tandem"" or the ""company"") (na…",2023-09-27T20:13:00Z,"los angeles, sept 27, 2023 /prnewswire/ -- the law offices of frank r cruz announces that investors with substantial losses have opportunity to lead the securities fraud class action lawsuit agains… [+2003 chars]"
marketscreenercom,business wire,dexcom solidifies global leadership in continuous glucose monitoring with new clinical data presented at easd,"(marketscreenercom) comisair study is now the longest prospective real-world cgm study ever conducted, demonstrating significant and continued hba1c reduction for patients using real-time cgm over seven years1 new data shows the dexcom one cgm system d…",2023-10-02T06:01:02Z,"comisair study is now the longest prospective real-world cgm study ever conducted, demonstrating significant and continued hba1c reduction for patients using real-time cgm over seven years1 new dat… [+9204 chars]"
globenewswire,datahorizzon research,infusion pumps market to reach usd 311 billion by 2032 cagr: 94% report by datahorizzon research,"according to datahorizzon research, the infusion pumps market size was valued at usd 128 billion in 2022 and is expected to have a market size of usd 311 billion by 2032 with a cagr of 94% according to datahorizzon research, the infusion pumps market size…",2023-09-29T00:20:00Z,"fort collins, colorado, sept 28, 2023 (globe newswire) -- datahorizzon research published a report titled, ""infusion pumps market size, growth, share, statistics report, by type (volumetric pumps, s… [+8472 chars]"
globenewswire,research and markets,"major players in the insulin patch pumps global market to 2030 include callnovo, medtronic, ypsomed, sanofi and more","dublin, sept 26, 2023 (globe newswire) -- the ""insulin patch pumps global market report 2023"" report has been added to researchandmarketscom's offeringmajor players in the insulin patch pumps market are cellnovo, insulet corporation, medtronic plc, tandem…",2023-09-26T10:03:00Z,"dublin, sept 26, 2023 (globe newswire) -- the ""insulin patch pumps global market report 2023"" report has been added to researchandmarketscom's offering major players in the insulin patch pumps ma… [+5076 chars]"
globenewswire,research and markets,global diabetes epidemic: unprecedented economic burden of $966 billion in 2021 underscores urgency for innovative therapeutics and diagnostics,"dublin, sept 18, 2023 (globe newswire) -- the ""global markets for diabetes therapeutics and diagnostics"" report has been added to researchandmarketscom's offering",2023-09-18T11:38:00Z,"dublin, sept 18, 2023 (globe newswire) -- the ""global markets for diabetes therapeutics and diagnostics"" report has been added to researchandmarketscom's offering the latest market analysis prese… [+7219 chars]"
globenewswire,marketresearchbiz,insulin pumps market to reach usd 120 billion in 2032 owing to rising prevalence of diabetes and advancements in insulin pumps,"marketresearchbiz reports that the global insulin pumps market is rapidly growing in revenue, driven by rising diabetes prevalence, technological advancements in insulin pump devices, and increasing awareness of the convenience of continuous insulin delivery…",2023-09-18T11:34:00Z,"new york, sept 18, 2023 (globe newswire) -- global insulin pumps market size was usd 53 billion in 2022 and is expected to reach usd 120 billion in 2032 and register a revenue cagr of 87% between… [+18755 chars]"
globenewswire,research and markets,technological innovations and advances in nanotechnology boost the efficiency of abdominal pads in wound care,"dublin, oct 09, 2023 (globe newswire) -- the ""abdominal pads market - global industry size, share, trends, opportunity, and forecast, 2018-2028 segmented by type (sterile, non-sterile), by application (surgical wounds, chronic wounds, burns, others), by end …",2023-10-09T08:48:00Z,"dublin, oct 09, 2023 (globe newswire) -- the ""abdominal pads market - global industry size, share, trends, opportunity, and forecast, 2018-2028 segmented by type (sterile, non-sterile), by applicati… [+5674 chars]"
prnewswire,,"shareholder alert: pomerantz law firm investigates claims on behalf of investors of tandem diabetes care, inc - tndm","new york, sept 29, 2023 /prnewswire/ -- pomerantz llp is investigating claims on behalf of investors of tandem diabetes care, inc (""tandem"" or the ""company"") (nasdaq: tndm) such investors are advised to contact robert s willoughby at newaction@pomlawcom …",2023-09-29T21:03:00Z,"new york, sept 29, 2023 /prnewswire/ -- pomerantz llp is investigating claims on behalf of investors of tandem diabetes care, inc (""tandem"" or the ""company"") (nasdaq: tndm) such investors are advi… [+1774 chars]"
globenewswire,vantage market research,"by 2030, demand for infusion pump market will surpass $2738394 million at 850% cagr growth | vantage market research","washington, sept 26, 2023 (globe newswire) -- the infusion pump market is valued at usd 1425799 million in 2022 and is expected to reach usd 2738394 million by 2030 at a cagr of 850% over the forecast period 2023-2030",2023-09-26T11:35:00Z,"washington, sept 26, 2023 (globe newswire) -- the infusion pump market is valued at usd 1425799 million in 2022 and is expected to reach usd 2738394 million by 2030 at a cagr of 850% over the for… [+10074 chars]"
pr newswire uk,,"insulin pump market size is expected to reach usd 1218 billion by 2028, with a 1364% cagr by 2028 | brandessence market research","london, sept 24, 2023 /prnewswire/ -- according to a comprehensive research report by brandessence market research (bmrc), ""insulin pump market by product type, by end user, industry analysis, trends, and forecast 2028"" the insulin pump market was valued at…",2023-09-25T03:38:00Z,"london, sept 24, 2023 /prnewswire/ -- according to a comprehensive research report by brandessence market research (bmrc), ""insulin pump market by product type, by end user, industry analysis, trend… [+11006 chars]"
prnewswire,,"insulin pump market size is expected to reach usd 1218 billion by 2028, with a 1364% cagr by 2028 | brandessence market research","london, sept 24, 2023 /prnewswire/ -- according to a comprehensive research report by brandessence market research (bmrc), ""insulin pump market by product type, by end user, industry analysis, trends, and forecast 2028"" the insulin pump market was valued at…",2023-09-25T03:23:00Z,"london, sept 24, 2023 /prnewswire/ -- according to a comprehensive research report by brandessence market research (bmrc), ""insulin pump market by product type, by end user, industry analysis, trend… [+10978 chars]"
marketscreenercom,business wire,"docgo partners with main line health in philadelphia to provide medical transportation, and agrees to collaborate on remote patient monitoring initiatives",(marketscreenercom) new expansion solidifies ambulnz by docgos position as one of the largest ambulance providers in philadelphia https://wwwmarketscreenercom/quote/stock/docgo-inc-129164811/news/docgo-partners-with-main-line-health-in-philadelphia-to-p…,2023-10-04T11:36:01Z,"new expansion solidifies ambulnz by docgos position as one of the largest ambulance providers in philadelphia docgo inc (nasdaq:dcgo), a leading provider of technology-enabled mobile health service… [+9478 chars]"
globenewswire,national association of specialty pharmacy (nasp),"national association of specialty pharmacy (nasp) welcomes new board chairman, new board members, and congratulates award winners at its record-breaking 2023 annual meeting & expo","the national association of specialty pharmacy (nasp) welcomes five new board members and announces industry award, poster, and scholarship winners at its record-breaking 2023 annual meeting & expo in grapevine, tx the national association of specialty pharm…",2023-09-21T19:13:00Z,"washington, dc, sept 21, 2023 (globe newswire) -- this week nasp immediate past board chairman, kyle skiermont, pharmd, announced the following: scott guisinger, vice president pharmacy (northeas… [+6404 chars]"
globenewswire,marketus,"connected drug delivery devices market set to reach usd 2,9809 million by 2032, fueled by personalized medicine trends","the rising popularity of connected drug delivery devices is driving the growth in demand for home healthcare these devices provide convenience and user-friendliness, making them a preferred choice for elderly individuals who wish to manage their medical cond…",2023-10-09T13:38:00Z,"new york, oct 09, 2023 (globe newswire) -- according to a recent report by marketus, the global connected drug delivery devices market size is expected to be worth around usd 2,9809 million by 203… [+13461 chars]"
prnewswire,,"top ranked rosen law firm encourages tandem diabetes care, inc investors to secure counsel before important deadline in securities class action - tndm","new york, sept 14, 2023 /prnewswire/ -- why: rosen law firm, a global investor rights law firm, announces the filing of a class action lawsuit on behalf of purchasers of securities of tandem diabetes care, inc (nasdaq: tndm) between august 3, 2022 and novem…",2023-09-14T23:49:00Z,"new york, sept 14, 2023 /prnewswire/ -- why: rosen law firm, a global investor rights law firm, announces the filing of a class action lawsuit on behalf of purchasers of securities of tandem diabet… [+4778 chars]"
prnewswire,,"rosen, a longstanding law firm, encourages tandem diabetes care, inc investors with losses in excess of $100k to secure counsel before important deadline in securities class action - tndm","new york, sept 28, 2023 /prnewswire/ -- why: rosen law firm, a global investor rights law firm, reminds purchasers of securities of tandem diabetes care, inc (nasdaq: tndm) between august 3, 2022 and november 2, 2022, both dates inclusive (the ""class period…",2023-09-28T20:03:00Z,"new york, sept 28, 2023 /prnewswire/ -- why: rosen law firm, a global investor rights law firm, reminds purchasers of securities of tandem diabetes care, inc (nasdaq: tndm) between august 3, 2022… [+4819 chars]"
globenewswire,marketus,infusion pump market projections: anticipated expansion to reach usd 226 billion by 2032 || marketus,"the market is experiencing significant growth due to the rising incidence of chronic diseases furthermore, ongoing advancements in drug delivery technologies are expected to drive further expansion in the market the market is experiencing significant growth…",2023-10-04T12:47:00Z,"new york, oct 04, 2023 (globe newswire) -- according to marketus, the infusion pump market size is expected to be worth around usd 226 billion by 2032 from usd 121 billion in 2022, growing at a c… [+13003 chars]"
globenewswire,the law offices of frank r cruz,"deadline alert for dfs, path, tndm, and lesl: the law offices of frank r cruz reminds investors of class actions on behalf of shareholders","los angeles, sept 28, 2023 (globe newswire) -- the law offices of frank r cruz reminds investors that class action lawsuits have been filed on behalf of shareholders of the following publicly-traded companies investors have until the deadlines listed belo…",2023-09-28T16:12:00Z,"los angeles, sept 28, 2023 (globe newswire) -- the law offices of frank r cruz reminds investors that class action lawsuits have been filed on behalf of shareholders of the following publicly-trade… [+6895 chars]"
globenewswire,the law offices of frank r cruz,"deadline alert for dfs, path, tndm, and lesl: the law offices of frank r cruz reminds investors of class actions on behalf of shareholders","los angeles, oct 10, 2023 (globe newswire) -- the law offices of frank r cruz reminds investors that class action lawsuits have been filed on behalf of shareholders of the following publicly-traded companies investors have until the deadlines listed below…",2023-10-10T16:12:00Z,"los angeles, oct 10, 2023 (globe newswire) -- the law offices of frank r cruz reminds investors that class action lawsuits have been filed on behalf of shareholders of the following publicly-traded… [+6894 chars]"
globenewswire,the law offices of frank r cruz,"deadline alert for dfs, path, tndm, and lesl: the law offices of frank r cruz reminds investors of class actions on behalf of shareholders","los angeles, sept 22, 2023 (globe newswire) -- the law offices of frank r cruz reminds investors that class action lawsuits have been filed on behalf of shareholders of the following publicly-traded companies investors have until the deadlines listed belo…",2023-09-22T16:16:00Z,"los angeles, sept 22, 2023 (globe newswire) -- the law offices of frank r cruz reminds investors that class action lawsuits have been filed on behalf of shareholders of the following publicly-trade… [+6895 chars]"
globenewswire,the law offices of frank r cruz,"deadline alert for dfs, path, tndm, and lesl: the law offices of frank r cruz reminds investors of class actions on behalf of shareholders","los angeles, sept 15, 2023 (globe newswire) -- the law offices of frank r cruz reminds investors that class action lawsuits have been filed on behalf of shareholders of the following publicly-traded companies investors have until the deadlines listed below…",2023-09-15T17:16:00Z,"los angeles, sept 15, 2023 (globe newswire) -- the law offices of frank r cruz reminds investors that class action lawsuits have been filed on behalf of shareholders of the following publicly-trade… [+6892 chars]"
globenewswire,the law offices of frank r cruz,"deadline alert for dfs, path, tndm, and lesl: the law offices of frank r cruz reminds investors of class actions on behalf of shareholders","los angeles, oct 05, 2023 (globe newswire) -- the law offices of frank r cruz reminds investors that class action lawsuits have been filed on behalf of shareholders of the following publicly-traded companies investors have until the deadlines listed below …",2023-10-05T16:15:00Z,"los angeles, oct 05, 2023 (globe newswire) -- the law offices of frank r cruz reminds investors that class action lawsuits have been filed on behalf of shareholders of the following publicly-traded… [+6891 chars]"
globenewswire,law offices of howard g smith,"deadline alert for tndm, lesl, pacw, docn: law offices of howard g smith reminds investors of class actions on behalf of shareholders","bensalem, pa, oct 05, 2023 (globe newswire) -- law offices of howard g smith reminds investors that class action lawsuits have been filed on behalf of shareholders of the following publicly-traded companies investors have until the deadlines listed below …",2023-10-05T13:30:00Z,"bensalem, pa, oct 05, 2023 (globe newswire) -- law offices of howard g smith reminds investors that class action lawsuits have been filed on behalf of shareholders of the following publicly-traded… [+4633 chars]"
globenewswire,law offices of howard g smith,"deadline alert for tndm, lesl, pacw, docn: law offices of howard g smith reminds investors of class actions on behalf of shareholders","bensalem, pa, sept 29, 2023 (globe newswire) -- law offices of howard g smith reminds investors that class action lawsuits have been filed on behalf of shareholders of the following publicly-traded companies investors have until the deadlines listed below…",2023-09-29T18:00:00Z,"bensalem, pa, sept 29, 2023 (globe newswire) -- law offices of howard g smith reminds investors that class action lawsuits have been filed on behalf of shareholders of the following publicly-tra… [+4636 chars]"
prnewswire,,"shareholder alert: pomerantz law firm investigates claims on behalf of investors of tandem diabetes care, inc - tndm","new york, sept 13, 2023 /prnewswire/ -- pomerantz llp is investigating claims on behalf of investors of tandem diabetes care, inc (""tandem"" or the ""company"") (nasdaq: tndm) such investors are advised to contact robert s willoughby at newaction@pomlawcom …",2023-09-13T21:03:00Z,"new york, sept 13, 2023 /prnewswire/ -- pomerantz llp is investigating claims on behalf of investors of tandem diabetes care, inc (""tandem"" or the ""company"") (nasdaq: tndm) such investors are a… [+1778 chars]"
prnewswire,,"shareholder alert: pomerantz law firm investigates claims on behalf of investors of tandem diabetes care, inc - tndm","new york, sept 21, 2023 /prnewswire/ -- pomerantz llp is investigating claims on behalf of investors of tandem diabetes care, inc (""tandem"" or the ""company"") (nasdaq: tndm) such investors are advised to contact robert s willoughby at newaction@pomlawcom …",2023-09-21T21:38:00Z,"new york, sept 21, 2023 /prnewswire/ -- pomerantz llp is investigating claims on behalf of investors of tandem diabetes care, inc (""tandem"" or the ""company"") (nasdaq: tndm) such investors are advi… [+1771 chars]"
