source,author,title,description,publishedAT,content
prnewswire,,"tndm shareholder alert: rosen, a globally recognized firm, encourages tandem diabetes care, inc investors to secure counsel before important deadline in securities class action - tndm","new york, sept 21, 2023 /prnewswire/ -- why: rosen law firm, a global investor rights law firm, reminds purchasers of securities of tandem diabetes care, inc (nasdaq: tndm) between august 3, 2022 and november 2, 2022, both dates inclusive (the ""class period…",2023-09-22T02:10:00Z,"new york, sept 21, 2023 /prnewswire/ -- why: rosen law firm, a global investor rights law firm, reminds purchasers of securities of tandem diabetes care, inc (nasdaq: tndm) between august 3, 202… [+4826 chars]"
prnewswire,,"tndm investor alert: tandem diabetes care, inc investors with substantial losses have opportunity to lead class action lawsuit","san diego, sept 16, 2023 /prnewswire/ -- robbins geller rudman & dowd llp announces that purchasers or acquirers of tandem diabetes care, inc (nasdaq: tndm) securities between august 3, 2022 and november 2, 2022, inclusive (the ""class period"") have until no…",2023-09-16T18:20:00Z,"san diego, sept 16, 2023 /prnewswire/ -- robbins geller rudman &amp; dowd llp announces that purchasers or acquirers of tandem diabetes care, inc (nasdaq: tndm) securities between august 3, 2022 an… [+4176 chars]"
prnewswire,,"revolutionary trends in diabetes monitoring devices set to propel market growth with 64% cagr, lancets and devices subsegment surges at 103% cagr","dublin, sept 14, 2023 /prnewswire/ -- the ""global markets for diabetes therapeutics and diagnostics"" report has been added to researchandmarketscom's offering the latest market analysis presents an optimistic outlook for the global diabetes therapeutics an…",2023-09-14T15:45:00Z,"dublin, sept 14, 2023 /prnewswire/ -- the ""global markets for diabetes therapeutics and diagnostics"" report has been added to researchandmarketscom's offering the latest market analysis presents… [+7611 chars]"
financial post,bloomberg news,a stock investors guide to navigating weight-loss opportunities,here are some of the stocks and sectors that are likely to see the biggest impact from the boom in demand for weight-loss drugs read on,2023-09-20T15:12:56Z,here are some of the stocks and sectors that are likely to see the biggest impact author of the article: the anti-diabetic medication ozempic made by danish pharmaceutical company novo nordisk a/s… [+12810 chars]
marketwatch,eleanor laise,"the ratings game: these diabetes stocks, pummeled by the ozempic craze, now look like bargains, analysts say","dexcom could be the first stock to break out of ‘glp jail, analysts say, as market continues to punish device makers",2023-10-05T13:38:09Z,"diabetes device stocks that have been crushed in recent months by an ozempic-fueled weight-loss drug frenzy have now been punished enough, some analysts say the markets enthusiasm for novo nordisks … [+4144 chars]"
plosorg,"tayane muniz fighera, betânia rodrigues dos santos, poli mara spritzer",lean mass and associated factors in women with pcos with different phenotypes,"although current evidence suggests increased risk of obesity, insulin resistance, and metabolic alterations in patients with polycystic ovary syndrome (pcos), especially of a hyperandrogenic phenotype, the impact of each one of these variables on muscle mass …",2023-10-05T14:00:00Z,"abstract although current evidence suggests increased risk of obesity, insulin resistance, and metabolic alterations in patients with polycystic ovary syndrome (pcos), especially of a hyperandrogeni… [+37407 chars]"
